,ngram,count
1653,else [verse 1] and well,1
1654,[verse 1] and well i,1
1655,1] and well i think,1
1656,and well i think i've,1
1657,well i think i've gone,1
2993,orange english light cast only,1
2995,light cast only one singular,1
1695,a train or lost in,1
2996,cast only one singular shadow,1
3011,oh oh,1
3010,someone oh oh,1
3009,loving someone oh oh,1
3008,me [chorus] loving someone oh,1
3007,within me [chorus] loving someone,1
3006,but within me [chorus] loving,1
3005,beside but within me [chorus],1
3004,not beside but within me,1
3003,are not beside but within,1
3002,you are not beside but,1
3001,for you are not beside,1
3000,shadow for you are not,1
2999,singular shadow for you are,1
2998,one singular shadow for you,1
2997,only one singular shadow for,1
1658,i think i've gone mad,1
1659,think i've gone mad isn't,1
1660,i've gone mad isn't that,1
1661,gone mad isn't that so,1
1680,mum check the car it,1
1681,check the car it can’t,1
1682,the car it can’t have,1
1683,car it can’t have gone,1
1684,it can’t have gone far,1
1685,can’t have gone far i,1
1686,have gone far i must,1
1687,gone far i must have,1
1688,far i must have left,1
1689,i must have left it,1
1690,must have left it on,1
1691,have left it on a,1
1692,left it on a train,1
1693,it on a train or,1
1694,on a train or lost,1
1679,oh mum check the car,1
1678,had oh mum check the,1
1677,never had oh mum check,1
1668,what a shame you've lost,1
1662,mad isn't that so sad?,1
1663,isn't that so sad? and,1
1664,that so sad? and what,1
1665,so sad? and what a,1
1666,sad? and what a shame,1
1667,and what a shame you've,1
1669,a shame you've lost a,1
1676,you never had oh mum,1
1670,shame you've lost a brain,1
1671,you've lost a brain that,1
1672,lost a brain that you,1
1673,a brain that you never,1
1674,brain that you never had,1
1675,that you never had oh,1
1716,jumped on a bus declared,1
1717,on a bus declared my,1
1718,a bus declared my name,1
1812,but she couldn't find a,1
1814,couldn't find a single trace,1
1815,find a single trace of,1
1816,a single trace of my,1
1817,single trace of my brain,1
1818,"trace of my brain ""oops",1
1819,"of my brain ""oops i",1
1820,"my brain ""oops i did",1
1821,"brain ""oops i did it",1
1822,"""oops i did it again""",1
1823,"i did it again"" started",1
1824,"did it again"" started playing",1
1825,"it again"" started playing forget",1
1826,"again"" started playing forget my",1
1827,started playing forget my brain,1
1828,playing forget my brain remember,1
1813,she couldn't find a single,1
1811,pain but she couldn't find,1
1793,would i be if i,1
1810,my pain but she couldn't,1
1795,be if i was my,1
1796,if i was my brain?”,1
1797,i was my brain?” [instrumental],1
1798,was my brain?” [instrumental] [outro],1
1799,my brain?” [instrumental] [outro] the,1
1800,brain?” [instrumental] [outro] the nice,1
1801,[instrumental] [outro] the nice nurse,1
1802,[outro] the nice nurse told,1
1803,the nice nurse told me,1
1804,nice nurse told me she,1
1805,nurse told me she felt,1
1806,told me she felt my,1
1807,me she felt my pain,1
1808,she felt my pain but,1
1809,felt my pain but she,1
1829,forget my brain remember my,1
1830,my brain remember my name,1
1831,brain remember my name [intro],1
1832,remember my name [intro] well,1
1856,your heart [chorus] well i,1
1857,heart [chorus] well i know,1
2923,is an operating system a,1
2922,language is an operating system,1
2921,‘cultural language is an operating,1
2920,how ‘cultural language is an,1
2919,about how ‘cultural language is,1
2918,blazed about how ‘cultural language,1
2917,she blazed about how ‘cultural,1
2916,mid-afternoon she blazed about how,1
2915,across mid-afternoon she blazed about,1
2914,sparse across mid-afternoon she blazed,1
2913,fallen sparse across mid-afternoon she,1
2912,leaves fallen sparse across mid-afternoon,1
2911,autumn leaves fallen sparse across,1
1855,of your heart [chorus] well,1
1854,sound of your heart [chorus],1
2924,an operating system a simple,1
2933,listless when tested with divinity,1
1833,my name [intro] well i,1
1834,name [intro] well i know,1
1835,[intro] well i know when,1
2876,progress but instead of selling,1
2935,tested with divinity or a,1
2934,when tested with divinity or,1
2932,and listless when tested with,1
2925,operating system a simple interface,1
2931,feeble and listless when tested,1
2930,rendered feeble and listless when,1
2929,interface rendered feeble and listless,1
2928,simple interface rendered feeble and,1
2927,a simple interface rendered feeble,1
2926,system a simple interface rendered,1
1794,i be if i was,1
1792,“where would i be if,1
1719,bus declared my name and,1
1737,"a run ""and would you",1
1739,"""and would you sign an",1
1740,would you sign an autograph,1
1741,you sign an autograph for,1
1742,sign an autograph for my,1
1743,an autograph for my daughter,1
1744,autograph for my daughter laura?,1
1745,for my daughter laura? cause,1
1746,my daughter laura? cause she,1
1747,daughter laura? cause she adores,1
1748,laura? cause she adores you,1
1749,cause she adores you but,1
1750,she adores you but i,1
1751,adores you but i think,1
1752,you but i think you’re,1
1753,"but i think you’re shit""",1
1738,"run ""and would you sign",1
1736,"for a run ""and would",1
1791,insane “where would i be,1
1735,"going for a run ""and",1
1720,declared my name and asked,1
1721,my name and asked if,1
1722,name and asked if anybody's,1
1723,and asked if anybody's seen,1
1724,asked if anybody's seen my,1
1725,if anybody's seen my brain,1
1726,anybody's seen my brain your,1
1727,seen my brain your brain,1
1728,my brain your brain was,1
1729,brain your brain was last,1
1730,your brain was last seen,1
1731,brain was last seen going,1
1732,was last seen going for,1
1733,last seen going for a,1
1734,seen going for a run,1
1754,"i think you’re shit"" ""i’ve",1
1755,"think you’re shit"" ""i’ve gotta",1
1756,"you’re shit"" ""i’ve gotta look",1
1757,"shit"" ""i’ve gotta look for",1
1776,do you expect when you’ve,1
1777,you expect when you’ve got,1
1778,expect when you’ve got no,1
1779,when you’ve got no mind!”,1
1780,you’ve got no mind!” i,1
1781,got no mind!” i searched,1
1782,no mind!” i searched all,1
1783,mind!” i searched all day,1
1784,i searched all day it,1
1785,searched all day it drove,1
1786,all day it drove me,1
1787,day it drove me insane,1
1788,it drove me insane “where,1
1789,drove me insane “where would,1
1790,me insane “where would i,1
1775,what do you expect when,1
1774,“well what do you expect,1
1773,eyes “well what do you,1
1764,for a bit!” i stepped,1
1758,"""i’ve gotta look for my",1
1759,gotta look for my brain,1
1760,look for my brain for,1
1761,for my brain for a,1
1762,my brain for a bit!”,1
1763,brain for a bit!” i,1
1765,a bit!” i stepped outside,1
1772,my eyes “well what do,1
1766,bit!” i stepped outside it,1
1767,i stepped outside it hurt,1
1768,stepped outside it hurt my,1
1769,outside it hurt my eyes,1
1770,it hurt my eyes “well,1
1771,hurt my eyes “well what,1
2877,but instead of selling sex,1
2175,it to well i thought,1
2875,to progress but instead of,1
2555,you've been reading 'bout yourself,1
2769,in a car park beside,1
2549,do oh yeah? no [verse,1
2550,oh yeah? no [verse 2],1
2551,yeah? no [verse 2] you've,1
2552,no [verse 2] you've been,1
2553,[verse 2] you've been reading,1
2554,2] you've been reading 'bout,1
2556,been reading 'bout yourself on,1
2516,you're reading about yourself on,1
2557,reading 'bout yourself on a,1
2558,'bout yourself on a plane,1
2559,yourself on a plane fame,1
2560,on a plane fame for,1
2561,a plane fame for a,1
2562,plane fame for a change,1
2563,fame for a change caught,1
2770,a car park beside where,1
2771,car park beside where your,1
2534,looking! [chorus] and love me,1
2533,looking looking! [chorus] and love,1
2518,about yourself on a plane,1
2519,yourself on a plane fame!,1
2520,on a plane fame! what,1
2521,a plane fame! what a,1
2522,plane fame! what a shame!,1
2523,fame! what a shame! oh!,1
2524,what a shame! oh! well,1
2525,a shame! oh! well just,1
2526,shame! oh! well just keep,1
2527,oh! well just keep looking,1
2528,well just keep looking looking,1
2529,just keep looking looking looking,1
2530,keep looking looking looking looking!,1
2531,looking looking looking looking! [chorus],1
2532,looking looking looking! [chorus] and,1
2564,for a change caught up,1
2565,a change caught up in,1
2566,change caught up in fashion,1
2585,but got nothing to say,1
2587,"nothing to say oh! ""you",1
2588,"to say oh! ""you look",1
2589,"say oh! ""you look famous",1
2590,"oh! ""you look famous let's",1
2591,"""you look famous let's be",1
2592,look famous let's be friends,1
2593,famous let's be friends and,1
2594,let's be friends and portray,1
2595,be friends and portray we,1
2596,friends and portray we possess,1
2597,and portray we possess something,1
2598,portray we possess something important,1
2599,we possess something important and,1
2600,possess something important and do,1
2601,something important and do the,1
2586,got nothing to say oh!,1
2584,face but got nothing to,1
2567,caught up in fashion karcrashian,1
2583,beautiful face but got nothing,1
2568,up in fashion karcrashian panache,1
2569,in fashion karcrashian panache and,1
2570,fashion karcrashian panache and a,1
2571,karcrashian panache and a bag,1
2572,panache and a bag of,1
2573,and a bag of bash,1
2574,a bag of bash for,1
2575,bag of bash for passion,1
2576,of bash for passion you,1
2577,bash for passion you got,1
2578,for passion you got a,1
2579,passion you got a beautiful,1
2580,you got a beautiful face,1
2581,got a beautiful face but,1
2582,a beautiful face but got,1
2517,reading about yourself on a,1
2515,find you're reading about yourself,1
2603,and do the things we'd,1
2466,but give me one [chorus],1
2459,3 minutes and i know,1
2460,minutes and i know it's,1
2461,and i know it's wrong,1
2462,i know it's wrong but,1
2463,know it's wrong but give,1
2464,it's wrong but give me,1
2465,wrong but give me one,1
2467,give me one [chorus] and,1
2514,you'll find you're reading about,1
2468,me one [chorus] and you're,1
2469,one [chorus] and you're the,1
2470,giving it up again [outro],1
2471,it up again [outro] i'm,1
2472,up again [outro] i'm not,1
2473,again [outro] i'm not giving,1
2474,[outro] i'm not giving it,1
2458,lasts 3 minutes and i,1
2457,only lasts 3 minutes and,1
2456,me? oh the kick won't,1
2455,for me? oh the kick,1
2440,lasts 3 minutes i think,1
2441,3 minutes i think i've,1
2442,minutes i think i've lost,1
2443,i think i've lost my,1
2444,think i've lost my phone,1
2445,i've lost my phone so,1
2446,lost my phone so won't,1
2447,my phone so won't you,1
2448,phone so won't you call,1
2449,so won't you call it,1
2450,won't you call it up,1
2451,you call it up for,1
2452,call it up for me?,1
2453,it up for me? oh,1
2454,up for me? oh the,1
2775,your nan resides are not,1
2774,where your nan resides are,1
2773,beside where your nan resides,1
2497,i'm just with my friends,1
2499,with my friends online and,1
2500,my friends online and there's,1
2501,friends online and there's things,1
2502,online and there's things we'd,1
2503,and there's things we'd like,1
2504,there's things we'd like to,1
2505,things we'd like to change!,1
2506,we'd like to change! oh!,1
2507,like to change! oh! yeah,1
2508,to change! oh! yeah next,1
2509,change! oh! yeah next thing,1
2510,oh! yeah next thing you'll,1
2511,yeah next thing you'll find,1
2512,next thing you'll find you're,1
2513,thing you'll find you're reading,1
2498,just with my friends online,1
2496,no! i'm just with my,1
2772,park beside where your nan,1
2495,sometimes? no! i'm just with,1
2480,up giving it up i'm,1
2481,it up giving it up!,1
2482,up giving it up! [verse,1
2483,giving it up! [verse 1],1
2484,it up! [verse 1] hey!,1
2485,up! [verse 1] hey! would,1
2486,[verse 1] hey! would you,1
2487,1] hey! would you like,1
2488,hey! would you like to,1
2489,would you like to look,1
2490,you like to look outside,1
2491,like to look outside sometimes?,1
2492,to look outside sometimes? no!,1
2493,look outside sometimes? no! i'm,1
2494,outside sometimes? no! i'm just,1
2602,important and do the things,1
2604,"do the things we'd like""",1
2874,trying to progress but instead,1
2696,is telling me the telly,1
2689,you should be [verse 1],1
2690,should be [verse 1] my,1
2691,be [verse 1] my heart,1
2692,[verse 1] my heart is,1
2693,1] my heart is telling,1
2694,my heart is telling me,1
2695,heart is telling me the,1
2697,telling me the telly isn't,1
2668,"ohhh"" [chorus] and love me",1
2698,me the telly isn't telling,1
2699,the telly isn't telling me,1
2700,telly isn't telling me anything,1
2701,isn't telling me anything i,1
2702,telling me anything i need,1
2703,me anything i need but,1
2704,anything i need but it,1
2688,yeah you should be [verse,1
2745,selling them sex it’s better,1
2746,them sex it’s better if,1
2747,sex it’s better if we,1
2670,me yeah oh yeah? no,1
2671,yeah oh yeah? no and,1
2672,you wanna do oh yeah,1
2673,wanna do oh yeah [chorus],1
2674,do oh yeah [chorus] yeah,1
2675,oh yeah [chorus] yeah you,1
2676,yeah [chorus] yeah you should,1
2677,[chorus] yeah you should be,1
2754,perplexed it's better if we,1
2753,them perplexed it's better if,1
2752,keep them perplexed it's better,1
2751,we keep them perplexed it's,1
2750,if we keep them perplexed,1
2749,better if we keep them,1
2748,it’s better if we keep,1
2705,i need but it needs,1
2706,need but it needs to,1
2707,but it needs to keep,1
2726,showing the kids that they,1
2728,kids that they matter who,1
2729,that they matter who are,1
2730,they matter who are they,1
2731,matter who are they gonna,1
2732,who are they gonna batter,1
2733,are they gonna batter next?,1
2734,they gonna batter next? just,1
2735,gonna batter next? just keep,1
2736,batter next? just keep holding,1
2737,next? just keep holding their,1
2738,just keep holding their necks,1
2739,keep holding their necks and,1
2740,holding their necks and keep,1
2741,their necks and keep selling,1
2742,necks and keep selling them,1
2727,the kids that they matter,1
2725,of showing the kids that,1
2708,it needs to keep selling,1
2724,instead of showing the kids,1
2709,needs to keep selling me,1
2710,to keep selling me besides,1
2711,keep selling me besides celebrities,1
2712,selling me besides celebrities lacking,1
2713,me besides celebrities lacking in,1
2714,besides celebrities lacking in integrity,1
2715,celebrities lacking in integrity holding,1
2716,lacking in integrity holding up,1
2717,in integrity holding up the,1
2718,integrity holding up the status,1
2719,holding up the status quo,1
2720,up the status quo instead,1
2721,the status quo instead of,1
2722,status quo instead of showing,1
2723,quo instead of showing the,1
2669,love me yeah oh yeah?,1
2667,"oh ohhh"" [chorus] and love",1
2605,"the things we'd like"" ""we've",1
2757,if we make them want,1
2764,sex disenfranchised young criminal minds,1
2763,opposite sex disenfranchised young criminal,1
2762,the opposite sex disenfranchised young,1
2761,want the opposite sex disenfranchised,1
2760,them want the opposite sex,1
2759,make them want the opposite,1
2758,we make them want the,1
2756,better if we make them,1
2666,"oh oh ohhh"" [chorus] and",1
2755,it's better if we make,1
2621,"we accept!"" yeah yeah yeah?!",1
2622,"accept!"" yeah yeah yeah?! no!",1
2623,yeah yeah yeah?! no! [chorus],1
2624,yeah yeah?! no! [chorus] and,1
2625,yeah?! no! [chorus] and love,1
2626,no! [chorus] and love me,1
2765,disenfranchised young criminal minds in,1
2766,young criminal minds in a,1
2767,criminal minds in a car,1
2768,minds in a car park,1
2606,"things we'd like"" ""we've just",1
2607,"we'd like"" ""we've just come",1
2608,"like"" ""we've just come to",1
2609,"""we've just come to represent",1
2610,just come to represent a,1
2611,come to represent a decline,1
2612,to represent a decline in,1
2613,represent a decline in the,1
2614,a decline in the standards,1
2615,decline in the standards of,1
2616,in the standards of what,1
2617,the standards of what we,1
2618,"standards of what we accept!""",1
2619,"of what we accept!"" yeah",1
2620,"what we accept!"" yeah yeah",1
2628,love me yeah oh if,1
2629,me yeah oh if that's,1
2630,yeah oh if that's what,1
2649,it to the people! be,1
2651,the people! be the man,1
2652,people! be the man that,1
2653,be the man that gets,1
2654,the man that gets them,1
2655,man that gets them up,1
2656,that gets them up on,1
2657,gets them up on their,1
2658,them up on their feet,1
2659,up on their feet say,1
2660,"on their feet say ""oh",1
2661,"their feet say ""oh oh",1
2662,"feet say ""oh oh oh",1
2663,"say ""oh oh oh oh",1
2664,"""oh oh oh oh ohhh""",1
2665,"oh oh oh ohhh"" [chorus]",1
2650,to the people! be the,1
2648,give it to the people!,1
2631,oh if that's what you,1
2647,calendar give it to the,1
2632,no and love me love,1
2633,and love me love me,1
2634,love me love me yeah,1
2635,me love me yeah if,1
2636,do oh yeah? no [interlude],1
2637,oh yeah? no [interlude] [bridge],1
2638,yeah? no [interlude] [bridge] oh,1
2639,no [interlude] [bridge] oh so,1
2640,[interlude] [bridge] oh so sack,1
2641,[bridge] oh so sack off,1
2642,oh so sack off your,1
2643,so sack off your calendar,1
2644,sack off your calendar give,1
2645,off your calendar give it,1
2646,your calendar give it to,1
2439,only lasts 3 minutes i,1
2428,[bridge] oh the kick won't,1
2427,again [bridge] oh the kick,1
2228,care about your beating chest,1
2221,'girl' won't even get you,1
2222,won't even get you undressed,1
2223,even get you undressed or,1
2224,get you undressed or care,1
2225,you undressed or care about,1
2226,undressed or care about your,1
2227,or care about your beating,1
2229,about your beating chest [chorus,1
2205,the one to rearrange your,1
2230,your beating chest [chorus ],1
2231,beating chest [chorus ] this,1
2232,chest [chorus ] this must,1
2233,[chorus ] this must be,1
2234,] this must be my,1
2235,fly around me baby this,1
2236,around me baby this must,1
2220,your 'girl' won't even get,1
2219,that your 'girl' won't even,1
2218,out that your 'girl' won't,1
2217,find out that your 'girl',1
2842,the purity of grief and,1
2841,on the purity of grief,1
2840,praying on the purity of,1
2839,and praying on the purity,1
2206,one to rearrange your world?,1
2207,to rearrange your world? you,1
2208,rearrange your world? you got,1
2209,your world? you got excited,1
2210,world? you got excited and,1
2211,you got excited and now,1
2212,got excited and now you,1
2213,excited and now you find,1
2214,and now you find out,1
2215,now you find out that,1
2216,you find out that your,1
2237,me baby this must be,1
2238,baby this must be my,1
2239,fly around me baby [instrumental,1
2258,stop pacing 'round the room,1
2260,'round the room using other,1
2261,the room using other people's,1
2262,room using other people's faces,1
2263,using other people's faces as,1
2264,other people's faces as a,1
2265,people's faces as a mirror,1
2266,faces as a mirror for,1
2267,as a mirror for you,1
2268,a mirror for you i,1
2269,mirror for you i know,1
2270,for you i know your,1
2271,you i know your lungs,1
2272,i know your lungs need,1
2273,know your lungs need filling,1
2274,your lungs need filling since,1
2259,pacing 'round the room using,1
2257,boy stop pacing 'round the,1
2240,around me baby [instrumental break],1
2256,hey boy stop pacing 'round,1
2241,me baby [instrumental break] [chorus,1
2242,baby [instrumental break] [chorus variation],1
2243,[instrumental break] [chorus variation] this,1
2244,break] [chorus variation] this must,1
2245,[chorus variation] this must be,1
2246,variation] this must be my,1
2247,fly around me baby [chorus],1
2248,around me baby [chorus] this,1
2249,me baby [chorus] this must,1
2250,baby [chorus] this must be,1
2251,around me baby [verse 1],1
2252,me baby [verse 1] hey,1
2253,baby [verse 1] hey boy,1
2254,[verse 1] hey boy stop,1
2255,1] hey boy stop pacing,1
2843,purity of grief and its,1
2204,"girl?"" the one to rearrange",1
2426,up again [bridge] oh the,1
2847,its simplicity but i know,1
2854,i'm too skeptical even guy,1
2853,maybe i'm too skeptical even,1
2852,that maybe i'm too skeptical,1
2851,know that maybe i'm too,1
2850,i know that maybe i'm,1
2849,but i know that maybe,1
2848,simplicity but i know that,1
2846,and its simplicity but i,1
2203,"this girl?"" the one to",1
2845,grief and its simplicity but,1
2844,of grief and its simplicity,1
2160,around me baby [verse 2],1
2161,me baby [verse 2] pipe,1
2162,baby [verse 2] pipe down,1
2163,[verse 2] pipe down you're,1
2164,2] pipe down you're no,1
2855,too skeptical even guy debord,1
2856,skeptical even guy debord needed,1
2857,even guy debord needed spectacles,1
2858,guy debord needed spectacles you,1
2873,i'm trying to progress but,1
2872,and i'm trying to progress,1
2871,cheques and i'm trying to,1
2870,intellectual cheques and i'm trying,1
2869,cashing intellectual cheques and i'm,1
2868,of cashing intellectual cheques and,1
2867,economy of cashing intellectual cheques,1
2866,greek economy of cashing intellectual,1
2865,the greek economy of cashing,1
2864,i'm the greek economy of,1
2863,see i'm the greek economy,1
2862,you see i'm the greek,1
2861,spectacles you see i'm the,1
2860,needed spectacles you see i'm,1
2859,debord needed spectacles you see,1
2165,pipe down you're no lover,1
2166,down you're no lover it's,1
2167,you're no lover it's failing,1
2186,i must be dreaming 'bout,1
2188,be dreaming 'bout feeling something,1
2189,dreaming 'bout feeling something instead,1
2190,'bout feeling something instead of,1
2191,feeling something instead of you,1
2192,something instead of you [pre-chorus],1
2193,"instead of you [pre-chorus] ""what",1
2194,"of you [pre-chorus] ""what did",1
2195,"you [pre-chorus] ""what did i",1
2196,"[pre-chorus] ""what did i tell",1
2197,"""what did i tell you",1
2198,did i tell you 'bout,1
2199,i tell you 'bout this,1
2200,"tell you 'bout this girl?""",1
2201,"you 'bout this girl?"" the",1
2202,"'bout this girl?"" the one",1
2187,must be dreaming 'bout feeling,1
2185,guess i must be dreaming,1
2168,no lover it's failing cos',1
2184,i guess i must be,1
2169,lover it's failing cos' you,1
2170,it's failing cos' you want,1
2171,failing cos' you want it,1
2172,cos' you want it to,1
2173,you want it to well,1
2174,want it to well i,1
2743,and keep selling them sex,1
2176,to well i thought it,1
2177,well i thought it was,1
2178,i thought it was love,1
2179,thought it was love but,1
2180,it was love but i,1
2181,was love but i guess,1
2182,love but i guess i,1
2183,but i guess i must,1
2275,lungs need filling since your,1
2276,need filling since your gums,1
2277,filling since your gums have,1
2777,resides are not slow they’ve,1
2784,been shown that you should,1
2783,never been shown that you,1
2782,just never been shown that,1
2781,they’ve just never been shown,1
2780,slow they’ve just never been,1
2779,not slow they’ve just never,1
2778,are not slow they’ve just,1
2379,giving it up again [verse,1
2278,since your gums have lost,1
2380,it up again [verse 2],1
2381,up again [verse 2] this,1
2382,again [verse 2] this conversation's,1
2383,[verse 2] this conversation's not,1
2384,2] this conversation's not about,1
2385,this conversation's not about reciprocation,1
2386,conversation's not about reciprocation no,1
2785,shown that you should be…,1
2786,that you should be… [chorus],1
2787,you should be… [chorus] loving,1
2788,should be… [chorus] loving someone,1
2806,man we’re sentient or something,1
2805,you man we’re sentient or,1
2804,like you man we’re sentient,1
2803,just like you man we’re,1
2802,we're just like you man,1
2801,human we're just like you,1
2800,all human we're just like,1
2799,we're all human we're just,1
2798,2] we're all human we're,1
2797,[verse 2] we're all human,1
2796,oh [verse 2] we're all,1
2795,oh oh [verse 2] we're,1
2794,someone oh oh [verse 2],1
2793,loving someone oh oh [verse,1
2789,be… [chorus] loving someone oh,1
2387,not about reciprocation no more,1
2388,about reciprocation no more but,1
2389,reciprocation no more but i'm,1
2408,my things my car my,1
2410,my car my living and,1
2411,car my living and how,1
2412,my living and how i'm,1
2413,living and how i'm giving,1
2414,and how i'm giving it,1
2415,how i'm giving it up,1
2416,i'm giving it up giving,1
2776,nan resides are not slow,1
2419,up giving it up again,1
2420,giving it up again [chorus],1
2421,it up again [chorus] and,1
2422,up again [chorus] and you're,1
2423,again [chorus] and you're the,1
2424,giving it up again [bridge],1
2425,it up again [bridge] oh,1
2409,things my car my living,1
2407,and my things my car,1
2390,no more but i'm gon',1
2406,me and my things my,1
2391,more but i'm gon' wait,1
2392,but i'm gon' wait until,1
2393,i'm gon' wait until you,1
2394,gon' wait until you finish,1
2395,wait until you finish so,1
2396,until you finish so i,1
2397,you finish so i can,1
2398,finish so i can talk,1
2399,so i can talk some,1
2400,i can talk some more,1
2401,can talk some more about,1
2402,talk some more about me,1
2403,some more about me and,1
2404,more about me and my,1
2405,about me and my things,1
2807,we’re sentient or something or,1
2808,sentient or something or other,1
2809,or something or other i,1
2296,have a card? my irregular,1
2298,card? my irregular heart beat,1
2299,my irregular heart beat is,1
2300,irregular heart beat is starting,1
2838,insecurity and praying on the,1
2301,heart beat is starting to,1
2302,beat is starting to correct,1
2303,"is starting to correct itself""",1
2304,"starting to correct itself"" it's",1
2837,exploiting insecurity and praying on,1
2836,telepathy exploiting insecurity and praying,1
2835,charlatan telepathy exploiting insecurity and,1
2834,boat charlatan telepathy exploiting insecurity,1
2833,a boat charlatan telepathy exploiting,1
