,ngram,count
1358,expecting the world and don't,1
1359,the world and don't fall,1
1360,world and don't fall in,1
1361,and don't fall in love,1
1362,don't fall in love with,1
1363,in love with the moment,1
1263,to learn [pre-chorus] and you,1
1261,a lot to learn [pre-chorus],1
1387,or you'll drown you think,1
1206,that was it [verse 1],1
1198,doesn't love me at all,1
1199,love me at all she,1
1200,when she lays down [matty,1
1201,she lays down [matty healy],1
1202,lays down [matty healy] that,1
1203,down [matty healy] that was,1
1204,[matty healy] that was it,1
1205,healy] that was it [verse,1
1207,was it [verse 1] big,1
1196,oh she doesn't love me,1
1208,it [verse 1] big town,1
1209,[verse 1] big town synthetic,1
1210,1] big town synthetic apparitions,1
1211,big town synthetic apparitions of,1
1212,town synthetic apparitions of not,1
1213,synthetic apparitions of not being,1
1214,apparitions of not being lonely,1
1215,"of not being lonely ""look!",1
1197,she doesn't love me at,1
1195,appalled oh she doesn't love,1
1260,got a lot to learn,1
1184,she chose cocaine but it,1
1176,reason to complain yeah and,1
1177,to complain yeah and in,1
1178,complain yeah and in the,1
1179,yeah and in the end,1
1180,and in the end she,1
1181,in the end she chose,1
1182,the end she chose cocaine,1
1183,end she chose cocaine but,1
1185,chose cocaine but it couldn't,1
1194,she's appalled oh she doesn't,1
1186,cocaine but it couldn't fix,1
1187,but it couldn't fix her,1
1188,it couldn't fix her brain,1
1189,couldn't fix her brain [chorus],1
1190,fix her brain [chorus] she's,1
1191,her brain [chorus] she's appalled,1
1192,brain [chorus] she's appalled oh,1
1193,[chorus] she's appalled oh she,1
1216,"not being lonely ""look! he's",1
1217,"being lonely ""look! he's having",1
1218,"lonely ""look! he's having a",1
1249,"said ""don't fall in love",1
1241,i guess i gotta wait,1
1242,guess i gotta wait my,1
1243,i gotta wait my turn,1
1244,gotta wait my turn i,1
1245,wait my turn i said,1
1246,"my turn i said ""don't",1
1247,"turn i said ""don't fall",1
1248,"i said ""don't fall in",1
1250,"""don't fall in love with",1
1219,"""look! he's having a breakdown",1
1252,"in love with the moment""",1
1253,"love with the moment"" she",1
1254,"with the moment"" she said",1
1255,"the moment"" she said i've",1
1256,"moment"" she said i've got",1
1257,she said i've got a,1
1258,said i've got a lot,1
1259,i've got a lot to,1
1240,enthralling i guess i gotta,1
1239,dancing enthralling i guess i,1
1238,she's dancing enthralling i guess,1
1237,now she's dancing enthralling i,1
1220,he's having a breakdown oh,1
1221,having a breakdown oh what,1
1222,a breakdown oh what a,1
1223,breakdown oh what a let,1
1224,oh what a let down,1
1225,what a let down a,1
1226,a let down a shame,1
1227,let down a shame i,1
1228,down a shame i think,1
1229,a shame i think he,1
1230,shame i think he might,1
1231,"i think he might die!""",1
1232,"think he might die!"" and",1
1233,"he might die!"" and now",1
1234,"might die!"" and now she's",1
1235,"die!"" and now she's dancing",1
1236,and now she's dancing enthralling,1
1386,careful or you'll drown you,1
1388,you'll drown you think you've,1
807,"racket ""i think i've spent",1
1567,you said you'd find someone,1
1559,i'll see your face c'mon,1
1560,see your face c'mon baby,1
1561,your face c'mon baby i,1
1562,face c'mon baby i know,1
1563,c'mon baby i know you,1
1564,baby i know you said,1
1565,i know you said you'd,1
1566,know you said you'd find,1
1568,said you'd find someone to,1
1557,time that i'll see your,1
1569,you'd find someone to take,1
1570,find someone to take my,1
1571,someone to take my place,1
1572,to take my place [pre-chorus],1
1573,take my place [pre-chorus] oh,1
1574,my place [pre-chorus] oh i,1
1575,place [pre-chorus] oh i just,1
1576,[pre-chorus] oh i just don't,1
1558,that i'll see your face,1
1556,last time that i'll see,1
1475,sounds the rest i can,1
1545,your body [verse 2] c'mon,1
1477,rest i can do without,1
1478,i can do without [chorus],1
1479,can do without [chorus] i,1
1480,do without [chorus] i don't,1
1481,without [chorus] i don't want,1
1,we awake? am i too,1
1543,don't want your body [verse,1
1544,want your body [verse 2],1
1546,body [verse 2] c'mon baby,1
1555,the last time that i'll,1
1547,[verse 2] c'mon baby i,1
1548,2] c'mon baby i know,1
1549,c'mon baby i know this,1
1550,baby i know this ain't,1
1551,i know this ain't the,1
1552,know this ain't the last,1
1553,this ain't the last time,1
1554,ain't the last time that,1
1577,oh i just don't believe,1
1578,i just don't believe that,1
1579,just don't believe that you,1
1610,that i should be gettin',1
1602,to believe in anything you're,1
1603,believe in anything you're saying,1
1604,in anything you're saying i'm,1
1605,anything you're saying i'm reminded,1
1606,you're saying i'm reminded that,1
1607,saying i'm reminded that i,1
1608,i'm reminded that i should,1
1609,reminded that i should be,1
1611,i should be gettin' over,1
1580,don't believe that you have,1
1612,should be gettin' over it,1
1613,be gettin' over it [chorus],1
1614,gettin' over it [chorus] i,1
1615,over it [chorus] i don't,1
1616,it [chorus] i don't want,1
1617,don't want your body [bridge],1
1618,want your body [bridge] get,1
1619,your body [bridge] get someone,1
1601,start to believe in anything,1
1600,i start to believe in,1
1599,time i start to believe,1
1598,every time i start to,1
1581,believe that you have got,1
1582,that you have got it,1
1583,you have got it in,1
1584,have got it in you,1
1585,got it in you 'cause,1
1586,it in you 'cause we,1
1587,in you 'cause we are,1
1588,you 'cause we are just,1
1589,'cause we are just gonna,1
1590,we are just gonna keep,1
1591,"are just gonna keep ""doin'",1
1592,"just gonna keep ""doin' it""",1
1593,"gonna keep ""doin' it"" and",1
1594,"keep ""doin' it"" and every",1
1595,"""doin' it"" and every time",1
1596,"it"" and every time i",1
1597,and every time i start,1
1476,the rest i can do,1
1474,make sounds the rest i,1
1389,drown you think you've got,1
1420,the same? you just keep,1
1412,your brain is proper weird,1
1413,brain is proper weird are,1
1414,is proper weird are you,1
1415,proper weird are you feeling,1
1416,weird are you feeling the,1
1417,are you feeling the same?,1
1418,you feeling the same? you,1
1419,feeling the same? you just,1
1421,same? you just keep nodding,1
1410,me but your brain is,1
1422,you just keep nodding at,1
1423,just keep nodding at me,1
1424,keep nodding at me looking,1
1425,nodding at me looking vacant,1
1426,at me looking vacant [breakdown],1
1427,me looking vacant [breakdown] she,1
1428,looking vacant [breakdown] she likes,1
1429,vacant [breakdown] she likes it,1
1411,but your brain is proper,1
1409,on me but your brain,1
1473,that make sounds the rest,1
1398,american she's american [bridge] well,1
1390,you think you've got it,1
1391,think you've got it figured,1
1392,you've got it figured out,1
1393,got it figured out [chorus],1
1394,it figured out [chorus] if,1
1395,figured out [chorus] if she,1
1396,out [chorus] if she likes,1
1397,so american she's american [bridge],1
1399,she's american [bridge] well your,1
1408,hold on me but your,1
1400,american [bridge] well your face,1
1401,[bridge] well your face has,1
1402,well your face has got,1
1403,your face has got a,1
1404,face has got a hold,1
1405,has got a hold on,1
1406,got a hold on me,1
1407,a hold on me but,1
1430,[breakdown] she likes it 'cause,1
1431,she likes it 'cause we,1
1432,likes it 'cause we just,1
1463,thought it was a lie,1
1455,you found somebody else and,1
1456,found somebody else and at,1
1457,somebody else and at first,1
1458,else and at first i,1
1459,and at first i thought,1
1460,at first i thought it,1
1461,first i thought it was,1
1462,i thought it was a,1
1464,it was a lie i,1
1433,it 'cause we just don't,1
1465,was a lie i took,1
1466,a lie i took all,1
1467,lie i took all my,1
1468,i took all my things,1
1469,took all my things that,1
1470,all my things that make,1
1471,my things that make sounds,1
1472,things that make sounds the,1
1454,heard you found somebody else,1
1453,i heard you found somebody,1
1452,so i heard you found,1
1451,1] so i heard you,1
1434,'cause we just don't eat,1
1435,socially relevant she's american she,1
1436,relevant she's american she says,1
1437,she's american she says i've,1
1438,american she says i've got,1
1439,so american she's american [chorus],1
1440,american she's american [chorus] if,1
1441,she's american [chorus] if she,1
1442,american [chorus] if she likes,1
1443,so american she's american if,1
1444,american she's american if she,1
1445,she's american if she likes,1
1446,american if she likes it,1
1447,american she's american [verse 1],1
1448,she's american [verse 1] so,1
1449,american [verse 1] so i,1
1450,[verse 1] so i heard,1
1175,no reason to complain yeah,1
1174,i've no reason to complain,1
1173,and i've no reason to,1
936,being an arsehole and counting,1
923,know how i'd love to,1
929,to paris again [verse 3],1
930,"paris again [verse 3] ""oh",1
931,"again [verse 3] ""oh stop",1
932,"[verse 3] ""oh stop being",1
933,"3] ""oh stop being an",1
934,"""oh stop being an arsehole",1
935,stop being an arsehole and,1
937,an arsehole and counting my,1
921,[chorus] ya know how i'd,1
938,arsehole and counting my eye,1
939,"and counting my eye rolls""",1
940,"counting my eye rolls"" ""they're",1
941,"my eye rolls"" ""they're like",1
942,"eye rolls"" ""they're like piss",1
943,"rolls"" ""they're like piss holes",1
944,"""they're like piss holes in",1
945,like piss holes in the,1
922,ya know how i'd love,1
920,"shame"" [chorus] ya know how",1
899,"hyperpoliticized sexual trysts ""oh i",1
909,"i said ""hey kids we're",1
901,"trysts ""oh i think my",1
902,"""oh i think my boyfriend's",1
903,i think my boyfriend's a,1
904,"think my boyfriend's a nihilist""",1
905,"my boyfriend's a nihilist"" i",1
906,"boyfriend's a nihilist"" i said",1
907,"a nihilist"" i said ""hey",1
908,"nihilist"" i said ""hey kids",1
910,"said ""hey kids we're all",1
919,"a shame"" [chorus] ya know",1
911,"""hey kids we're all just",1
912,kids we're all just the,1
913,we're all just the same,1
914,all just the same what,1
915,just the same what a,1
916,"the same what a shame""",1
917,"same what a shame"" [chorus]",1
918,"what a shame"" [chorus] ya",1
946,"piss holes in the snow""",1
947,"holes in the snow"" -",1
948,"in the snow"" - uh",1
979,"for myself"" and then she",1
971,you're clean but only by,1
972,clean but only by seeing,1
973,but only by seeing your,1
974,only by seeing your face,1
975,by seeing your face for,1
976,"seeing your face for myself""",1
977,"your face for myself"" and",1
978,"face for myself"" and then",1
980,"myself"" and then she pointed",1
949,"the snow"" - uh oh",1
981,and then she pointed at,1
982,then she pointed at the,1
983,she pointed at the bag,1
984,pointed at the bag of,1
985,at the bag of her,1
986,the bag of her dreams,1
987,bag of her dreams in,1
988,of her dreams in a,1
970,believe you're clean but only,1
969,i'll believe you're clean but,1
968,"""well i'll believe you're clean",1
967,"shelf ""well i'll believe you're",1
950,"snow"" - uh oh keeping",1
951,- uh oh keeping a,1
952,uh oh keeping a tab,1
953,oh keeping a tab on,1
954,keeping a tab on my,1
955,a tab on my health,1
956,tab on my health man,1
957,on my health man you're,1
958,my health man you're putting,1
959,health man you're putting me,1
960,man you're putting me up,1
961,you're putting me up on,1
962,putting me up on a,1
963,me up on a shelf,1
964,"up on a shelf ""well",1
965,"on a shelf ""well i'll",1
966,"a shelf ""well i'll believe",1
900,"sexual trysts ""oh i think",1
898,"wrists hyperpoliticized sexual trysts ""oh",1
1172,dust and i've no reason,1
844,a friend? i got two,1
836,man lend me a gram,1
837,lend me a gram you,1
838,me a gram you call,1
839,a gram you call yourself,1
840,gram you call yourself a,1
841,you call yourself a friend?,1
842,call yourself a friend? i,1
843,yourself a friend? i got,1
845,friend? i got two left,1
834,mr serotonin man lend me,1
846,i got two left feet,1
847,got two left feet and,1
848,two left feet and i'm,1
849,left feet and i'm starting,1
850,feet and i'm starting to,1
851,and i'm starting to cheat,1
852,i'm starting to cheat on,1
853,starting to cheat on my,1
835,serotonin man lend me a,1
833,2] mr serotonin man lend,1
897,her wrists hyperpoliticized sexual trysts,1
816,"your friends"" [chorus] oh how",1
808,"""i think i've spent all",1
809,think i've spent all my,1
810,i've spent all my money,1
811,spent all my money and,1
812,all my money and your,1
813,"my money and your friends""",1
814,"money and your friends"" [chorus]",1
815,"and your friends"" [chorus] oh",1
817,"friends"" [chorus] oh how i'd",1
832,[verse 2] mr serotonin man,1
818,[chorus] oh how i'd love,1
824,go to paris again oh,1
825,to paris again oh how,1
826,paris again oh how i'd,1
827,again oh how i'd love,1
829,to paris again [verse 2],1
830,paris again [verse 2] mr,1
831,again [verse 2] mr serotonin,1
854,to cheat on my girlfriend,1
855,cheat on my girlfriend again,1
856,on my girlfriend again i,1
887,that she had to miss,1
879,where this train goes there,1
880,this train goes there was,1
881,train goes there was a,1
882,goes there was a party,1
883,there was a party that,1
884,was a party that she,1
885,a party that she had,1
886,party that she had to,1
888,she had to miss because,1
857,my girlfriend again i caught,1
889,had to miss because her,1
890,to miss because her friend,1
891,miss because her friend kept,1
892,because her friend kept cutting,1
893,her friend kept cutting her,1
894,friend kept cutting her wrists,1
895,kept cutting her wrists hyperpoliticized,1
896,cutting her wrists hyperpoliticized sexual,1
878,know where this train goes,1
877,you know where this train,1
876,suppose you know where this,1
875,don't suppose you know where,1
858,girlfriend again i caught her,1
859,again i caught her picking,1
860,i caught her picking her,1
861,caught her picking her nose,1
862,her picking her nose as,1
863,picking her nose as the,1
864,her nose as the crowd,1
865,nose as the crowd cheered,1
866,as the crowd cheered for,1
867,the crowd cheered for an,1
868,crowd cheered for an overdose,1
869,cheered for an overdose and,1
870,for an overdose and i,1
871,an overdose and i don't,1
872,overdose and i don't suppose,1
873,and i don't suppose you,1
874,i don't suppose you know,1
989,her dreams in a well,1
990,dreams in a well posh,1
991,in a well posh magazine,1
1109,she begins to weep [chorus],1
1101,and when i go to,1
1102,when i go to sleep,1
1103,i go to sleep it's,1
1104,go to sleep it's when,1
1105,to sleep it's when she,1
1106,sleep it's when she begins,1
1107,it's when she begins to,1
1108,when she begins to weep,1
1110,begins to weep [chorus] she's,1
1099,too much and when i,1
1111,to weep [chorus] she's appalled,1
1112,weep [chorus] she's appalled by,1
1113,[chorus] she's appalled by not,1
1114,she's appalled by not loving,1
1115,appalled by not loving me,1
1116,by not loving me at,1
1117,not loving me at all,1
1118,loving me at all she,1
1100,much and when i go,1
1098,for too much and when,1
992,a well posh magazine i,1
1087,just wants to feel something,1
1079,is brown she's scared to,1
1080,brown she's scared to touch,1
1081,she's scared to touch and,1
1082,scared to touch and she,1
1083,to touch and she just,1
1084,touch and she just wants,1
1085,and she just wants to,1
1086,she just wants to feel,1
1088,wants to feel something and,1
1097,asking for too much and,1
1089,to feel something and i,1
1090,feel something and i don't,1
1091,something and i don't think,1
1092,and i don't think that's,1
1093,i don't think that's asking,1
1094,don't think that's asking for,1
1095,think that's asking for too,1
1096,that's asking for too much,1
1129,when she lays down [verse,1
1130,she lays down [verse 3],1
1131,lays down [verse 3] we,1
1162,over terrain the engines all,1
1154,to alleviate the pain over,1
1155,alleviate the pain over the,1
1156,the pain over the water,1
1157,pain over the water hmm,1
1158,over the water hmm over,1
1159,the water hmm over terrain,1
1160,water hmm over terrain the,1
1161,hmm over terrain the engines,1
1163,terrain the engines all go,1
1132,down [verse 3] we got,1
1164,the engines all go bust,1
1165,engines all go bust we,1
1166,all go bust we turned,1
1167,go bust we turned to,1
1168,bust we turned to dust,1
1169,we turned to dust and,1
1170,turned to dust and i've,1
1171,to dust and i've no,1
1153,simply to alleviate the pain,1
1152,sky simply to alleviate the,1
1151,the sky simply to alleviate,1
1150,from the sky simply to,1
1133,[verse 3] we got a,1
1134,3] we got a plane,1
1135,we got a plane oh,1
1136,got a plane oh to,1
1137,a plane oh to see,1
1138,plane oh to see my,1
1139,oh to see my dad,1
1140,to see my dad again,1
1141,see my dad again she,1
1142,my dad again she prayed,1
1143,dad again she prayed that,1
1144,again she prayed that we'd,1
1145,she prayed that we'd fall,1
1146,prayed that we'd fall from,1
1147,that we'd fall from the,1
1148,we'd fall from the sky,1
1149,fall from the sky simply,1
1078,hair is brown she's scared,1
1077,my hair is brown she's,1
1076,2] my hair is brown,1
1022,and oh how i'd love,1
1014,green she said i've been,1
1015,she said i've been romanticizing,1
1016,said i've been romanticizing heroin,1
1017,i've been romanticizing heroin [chorus],1
1018,been romanticizing heroin [chorus] and,1
1019,romanticizing heroin [chorus] and oh,1
1020,heroin [chorus] and oh how,1
1021,[chorus] and oh how i'd,1
1023,to go to paris to,1
1033,she lays down on her,1
1024,go to paris to paris,1
1025,to paris to paris again,1
1026,paris to paris again and,1
1027,to paris again [verse 1],1
1028,paris again [verse 1] and,1
1029,again [verse 1] and she,1
1030,[verse 1] and she lays,1
1031,1] and she lays down,1
1013,bethnal green she said i've,1
1012,on bethnal green she said,1
1011,up on bethnal green she,1
1010,picking up on bethnal green,1
993,well posh magazine i said,1
994,"posh magazine i said ""i'm",1
995,"magazine i said ""i'm done",1
996,"i said ""i'm done babe",1
997,"said ""i'm done babe i'm",1
998,"""i'm done babe i'm out",1
999,done babe i'm out of,1
1000,babe i'm out of the,1
1001,i'm out of the scene,1
1002,"out of the scene """,1
1003,"of the scene "" but",1
1004,"the scene "" but i",1
1005,"scene "" but i was",1
1006,""" but i was picking",1
1007,but i was picking up,1
1008,i was picking up on,1
1009,was picking up on bethnal,1
1032,and she lays down on,1
1034,lays down on her bedroom,1
1075,[verse 2] my hair is,1
1065,sun is gone she'd like,1
1057,it hurts her chest and,1
1058,hurts her chest and even,1
1059,her chest and even though,1
1060,chest and even though her,1
1061,and even though her sun,1
1062,even though her sun is,1
1063,though her sun is gone,1
1064,her sun is gone she'd,1
1066,is gone she'd like to,1
1035,down on her bedroom floor,1
1067,gone she'd like to love,1
1068,she'd like to love her,1
1069,like to love her child,1
1070,to love her child nevertheless,1
1071,love her child nevertheless [verse,1
1072,her child nevertheless [verse 2],1
1073,child nevertheless [verse 2] my,1
1074,nevertheless [verse 2] my hair,1
1056,but it hurts her chest,1
1055,best but it hurts her,1
1054,her best but it hurts,1
1053,tries her best but it,1
1036,on her bedroom floor the,1
1037,her bedroom floor the chemicals,1
1038,bedroom floor the chemicals that,1
1039,floor the chemicals that make,1
1040,the chemicals that make her,1
1041,chemicals that make her love,1
1042,that make her love don't,1
1043,make her love don't seem,1
1044,her love don't seem to,1
1045,love don't seem to be,1
1046,don't seem to be working,1
1047,seem to be working anymore,1
1048,to be working anymore she,1
1049,be working anymore she tries,1
1050,working anymore she tries her,1
1051,anymore she tries her best,1
1052,she tries her best but,1
3012,oh,1
