,ngram,count
2305,"to correct itself"" it's just",1
2306,"correct itself"" it's just a",1
2297,a card? my irregular heart,1
2295,you have a card? my,1
2308,it's just a simple diarrhetic,1
2294,"""do you have a card?",1
2279,your gums have lost their,1
2280,gums have lost their feeling,1
2281,have lost their feeling but,1
2282,lost their feeling but don't,1
2283,their feeling but don't say,1
2284,feeling but don't say that,1
2285,but don't say that you're,1
2286,don't say that you're giving,1
2287,say that you're giving it,1
2288,that you're giving it up,1
2289,you're giving it up again,1
2290,"giving it up again ""do",1
2291,"it up again ""do you",1
2292,"up again ""do you have",1
2293,"again ""do you have a",1
2307,"itself"" it's just a simple",1
2309,just a simple diarrhetic that,1
2810,something or other i can’t,1
2827,the ground we wouldn't be,1
2825,safer on the ground we,1
2824,was safer on the ground,1
2823,it was safer on the,1
2822,if it was safer on,1
2821,afloat if it was safer,1
2820,people afloat if it was,1
2819,have people afloat if it,1
2818,shouldn't have people afloat if,1
2817,we shouldn't have people afloat,1
2816,whatever we shouldn't have people,1
2815,remember whatever we shouldn't have,1
2814,can’t remember whatever we shouldn't,1
2813,i can’t remember whatever we,1
2812,other i can’t remember whatever,1
2811,or other i can’t remember,1
2826,on the ground we wouldn't,1
2828,ground we wouldn't be on,1
2310,a simple diarrhetic that prevents,1
2829,we wouldn't be on a,1
2311,simple diarrhetic that prevents the,1
2832,on a boat charlatan telepathy,1
2313,that prevents the empathetic from,1
2314,prevents the empathetic from being,1
2315,the empathetic from being just,1
2316,empathetic from being just and,1
2317,from being just and giving,1
2318,being just and giving it,1
2319,just and giving it up,1
2320,and giving it up [chorus],1
2321,giving it up [chorus] and,1
2322,it up [chorus] and you're,1
2323,up [chorus] and you're the,1
2831,be on a boat charlatan,1
2830,wouldn't be on a boat,1
2312,diarrhetic that prevents the empathetic,1
0,are we awake? am i,1
1621,[bridge] get someone you love?,1
577,the same when i scratch,1
569,don't like it now you're,1
570,like it now you're dead,1
571,it now you're dead it's,1
572,now you're dead it's not,1
573,you're dead it's not the,1
574,dead it's not the same,1
575,it's not the same when,1
576,not the same when i,1
578,same when i scratch my,1
567,died i don't like it,1
579,when i scratch my own,1
580,i scratch my own head,1
581,scratch my own head i,1
582,my own head i haven't,1
583,own head i haven't got,1
584,head i haven't got the,1
585,i haven't got the nails,1
586,haven't got the nails for,1
568,i don't like it now,1
566,you died i don't like,1
545,sleepless knights a grown up,1
555,i thought might just save,1
547,a grown up man dressed,1
548,grown up man dressed in,1
549,up man dressed in white,1
550,man dressed in white who,1
551,dressed in white who i,1
552,in white who i thought,1
553,white who i thought might,1
554,who i thought might just,1
556,thought might just save your,1
565,so you died i don't,1
557,might just save your life,1
558,just save your life but,1
559,save your life but he,1
560,your life but he couldn't,1
561,life but he couldn't so,1
562,but he couldn't so you,1
563,he couldn't so you died,1
564,couldn't so you died i,1
587,got the nails for it,1
588,the nails for it and,1
589,nails for it and i,1
620,fleece from my dad or,1
612,me sometimes so i reached,1
613,sometimes so i reached for,1
614,so i reached for a,1
615,i reached for a borrowed,1
616,reached for a borrowed fleece,1
617,for a borrowed fleece from,1
618,a borrowed fleece from my,1
619,borrowed fleece from my dad,1
621,from my dad or from,1
590,for it and i know,1
622,my dad or from denise,1
623,dad or from denise always,1
624,or from denise always trying,1
625,from denise always trying to,1
626,denise always trying to keep,1
627,always trying to keep warm,1
628,trying to keep warm when,1
629,to keep warm when you're,1
611,hear me sometimes so i,1
610,you hear me sometimes so,1
609,think you hear me sometimes,1
608,to think you hear me,1
591,it and i know that,1
592,and i know that god,1
593,i know that god doesn't,1
594,know that god doesn't exist,1
595,that god doesn't exist and,1
596,god doesn't exist and all,1
597,doesn't exist and all the,1
598,exist and all the palaver,1
599,and all the palaver surrounding,1
600,all the palaver surrounding it,1
601,the palaver surrounding it but,1
602,palaver surrounding it but i,1
603,surrounding it but i like,1
604,it but i like to,1
605,but i like to think,1
606,i like to think you,1
607,like to think you hear,1
546,knights a grown up man,1
544,oh sleepless knights a grown,1
631,warm when you're the sun,1
449,hell then miss you better,1
441,and if you don't want,1
442,if you don't want to,1
443,you don't want to go,1
444,don't want to go to,1
445,want to go to hell,1
446,to go to hell then,1
447,go to hell then miss,1
448,to hell then miss you,1
450,then miss you better start,1
439,an evangelist and if you,1
451,miss you better start selling,1
452,you better start selling this,1
453,better start selling this [chorus],1
454,start selling this [chorus] and,1
455,selling this [chorus] and if,1
456,this [chorus] and if i,1
457,you jesus show yourself [outro],1
458,jesus show yourself [outro] if,1
440,evangelist and if you don't,1
438,i'm an evangelist and if,1
543,missed oh sleepless knights a,1
427,shouldn't have made me atheist,1
419,was you that made my,1
420,you that made my body,1
421,that made my body you,1
422,made my body you probably,1
423,my body you probably shouldn't,1
424,body you probably shouldn't have,1
425,you probably shouldn't have made,1
426,probably shouldn't have made me,1
428,have made me atheist but,1
437,kiss i'm an evangelist and,1
429,made me atheist but oh,1
430,me atheist but oh i’m,1
431,atheist but oh i’m a,1
432,but oh i’m a lesbian,1
433,oh i’m a lesbian kiss,1
434,i’m a lesbian kiss i'm,1
435,a lesbian kiss i'm an,1
436,lesbian kiss i'm an evangelist,1
459,show yourself [outro] if i'm,1
460,yourself [outro] if i'm lost,1
461,[outro] if i'm lost then,1
533,just did i'd fill you,1
525,wish you'd walk in again,1
526,you'd walk in again imagine,1
527,walk in again imagine if,1
528,in again imagine if you,1
529,again imagine if you just,1
530,imagine if you just did,1
531,if you just did i'd,1
532,you just did i'd fill,1
534,did i'd fill you in,1
476,can i find myself? then,1
535,i'd fill you in on,1
536,fill you in on the,1
537,you in on the things,1
538,in on the things you,1
539,on the things you missed,1
540,the things you missed oh,1
541,things you missed oh sleepless,1
542,you missed oh sleepless knights,1
524,i wish you'd walk in,1
523,it? i wish you'd walk,1
522,feel it? i wish you'd,1
521,you feel it? i wish,1
477,i find myself? then how,1
478,find myself? then how can,1
479,myself? then how can i,1
482,find myself? yeah yeah yeah,1
483,myself? yeah yeah yeah if,1
484,yeah yeah yeah if i'm,1
485,yeah yeah if i'm lost,1
486,yeah if i'm lost now,1
487,find myself? yeah yeah and,1
488,myself? yeah yeah and he,1
489,yeah yeah and he said,1
490,"yeah and he said ""i've",1
516,can you feel it? and,1
517,you feel it? and he,1
518,feel it? and he said,1
519,"it? and he said ""i've",1
520,can you feel it? i,1
630,keep warm when you're the,1
632,when you're the sun i,1
417,if it was you that,1
751,share friends in soho she's,1
743,said 'hello' she was letting,1
744,'hello' she was letting me,1
745,she was letting me know,1
746,was letting me know we,1
747,letting me know we share,1
748,me know we share friends,1
749,know we share friends in,1
750,we share friends in soho,1
752,friends in soho she's a,1
741,1] she said 'hello' she,1
753,in soho she's a pain,1
754,soho she's a pain in,1
755,she's a pain in the,1
756,a pain in the nose,1
757,pain in the nose and,1
758,in the nose and i'm,1
759,the nose and i'm a,1
760,nose and i'm a pain,1
742,she said 'hello' she was,1
740,[verse 1] she said 'hello',1
719,it's like you never left,1
729,i think you can tell,1
721,you never left but i'm,1
722,never left but i'm bereft,1
723,left but i'm bereft you,1
724,but i'm bereft you see,1
725,i'm bereft you see i,1
726,bereft you see i think,1
727,you see i think you,1
728,see i think you can,1
730,think you can tell i,1
739,well [verse 1] she said,1
731,you can tell i haven't,1
732,can tell i haven't been,1
733,tell i haven't been doing,1
734,i haven't been doing too,1
735,haven't been doing too well,1
736,been doing too well [verse,1
737,doing too well [verse 1],1
738,too well [verse 1] she,1
761,and i'm a pain in,1
762,i'm a pain in women's,1
763,a pain in women's clothes,1
794,to leave because she couldn't,1
786,the back of a fag,1
787,back of a fag packet,1
788,of a fag packet she,1
789,a fag packet she had,1
790,fag packet she had to,1
791,packet she had to leave,1
792,she had to leave because,1
793,had to leave because she,1
795,leave because she couldn't hack,1
764,"pain in women's clothes ""and",1
796,because she couldn't hack it,1
797,she couldn't hack it not,1
798,couldn't hack it not enough,1
799,hack it not enough noise,1
800,it not enough noise and,1
801,not enough noise and too,1
802,enough noise and too much,1
803,noise and too much racket,1
785,on the back of a,1
784,it on the back of,1
783,for it on the back,1
782,plan for it on the,1
765,"in women's clothes ""and you're",1
766,"women's clothes ""and you're a",1
767,"clothes ""and you're a walking",1
768,"""and you're a walking overdose",1
769,you're a walking overdose in,1
770,a walking overdose in a,1
771,walking overdose in a great,1
772,"overdose in a great coat""",1
773,"in a great coat"" and",1
774,"a great coat"" and so",1
775,"great coat"" and so she",1
776,"coat"" and so she wrote",1
777,and so she wrote a,1
778,so she wrote a plan,1
779,she wrote a plan for,1
780,wrote a plan for it,1
781,a plan for it on,1
720,like you never left but,1
718,and it's like you never,1
633,you're the sun i sat,1
664,i hope i'm half as,1
656,nails red and if i,1
657,red and if i live,1
658,and if i live past,1
659,if i live past 72,1
660,i live past 72 i,1
661,live past 72 i hope,1
662,past 72 i hope i'm,1
663,72 i hope i'm half,1
665,hope i'm half as cool,1
654,had your nails red and,1
666,i'm half as cool as,1
667,half as cool as you,1
668,as cool as you i,1
669,cool as you i got,1
670,as you i got my,1
671,you i got my pen,1
672,i got my pen and,1
673,got my pen and thought,1
655,your nails red and if,1
653,still had your nails red,1
717,ring and it's like you,1
642,bed and cried for things,1
634,the sun i sat with,1
635,sun i sat with you,1
636,i sat with you beside,1
637,sat with you beside your,1
638,with you beside your bed,1
639,you beside your bed and,1
640,beside your bed and cried,1
641,your bed and cried for,1
643,and cried for things that,1
652,you still had your nails,1
644,cried for things that i,1
645,for things that i wish,1
646,things that i wish i'd,1
647,that i wish i'd said,1
648,i wish i'd said you,1
649,wish i'd said you still,1
650,i'd said you still had,1
651,said you still had your,1
674,my pen and thought that,1
675,pen and thought that i'd,1
676,and thought that i'd write,1
707,me close to you the,1
699,my room this simple tune,1
700,room this simple tune will,1
701,this simple tune will always,1
702,simple tune will always keep,1
703,tune will always keep me,1
704,will always keep me close,1
705,always keep me close to,1
706,keep me close to you,1
708,close to you the crowds,1
677,thought that i'd write a,1
709,to you the crowds will,1
710,you the crowds will sing,1
711,the crowds will sing their,1
712,crowds will sing their voices,1
713,will sing their voices ring,1
714,sing their voices ring and,1
715,their voices ring and it's,1
716,voices ring and it's like,1
698,in my room this simple,1
697,made in my room this,1
696,alright made in my room,1
695,feel alright made in my,1
678,that i'd write a melody,1
679,i'd write a melody and,1
680,write a melody and line,1
681,a melody and line for,1
682,melody and line for you,1
683,and line for you tonight,1
684,line for you tonight i,1
685,for you tonight i think,1
686,you tonight i think that's,1
687,tonight i think that's how,1
688,i think that's how i,1
689,think that's how i make,1
690,that's how i make things,1
691,how i make things feel,1
692,i make things feel alright,1
693,make things feel alright made,1
694,things feel alright made in,1
418,it was you that made,1
416,mean if it was you,1
1620,body [bridge] get someone you,1
123,a picture of your salad,1
115,were full of regret and,1
116,full of regret and then,1
117,of regret and then you,1
118,regret and then you took,1
119,and then you took a,1
120,then you took a picture,1
121,you took a picture of,1
122,took a picture of your,1
124,picture of your salad and,1
113,your eyes were full of,1
125,of your salad and put,1
126,your salad and put it,1
127,salad and put it on,1
128,and put it on the,1
129,put it on the internet,1
130,it on the internet and,1
131,on the internet and she,1
132,the internet and she said,1
114,eyes were full of regret,1
112,diseases your eyes were full,1
91,and you were coming across,1
101,the wrong end of your,1
93,were coming across as clever,1
94,coming across as clever then,1
95,across as clever then you,1
96,as clever then you lit,1
97,clever then you lit the,1
98,then you lit the wrong,1
99,you lit the wrong end,1
100,lit the wrong end of,1
102,wrong end of your cigarette,1
111,of diseases your eyes were,1
103,end of your cigarette you,1
104,of your cigarette you said,1
105,your cigarette you said i'm,1
106,cigarette you said i'm full,1
107,you said i'm full of,1
108,said i'm full of diseases,1
109,i'm full of diseases your,1
110,full of diseases your eyes,1
133,"internet and she said ""i've",1
134,"and she said ""i've been",1
137,"""i've been so worried about",1
168,face straight out of a,1
160,"looking like that"" you used",1
161,"like that"" you used to",1
162,"that"" you used to have",1
163,you used to have a,1
164,used to have a face,1
165,to have a face straight,1
166,have a face straight out,1
167,a face straight out of,1
169,straight out of a magazine,1
138,been so worried about you,1
170,out of a magazine now,1
171,of a magazine now you,1
172,a magazine now you just,1
173,magazine now you just look,1
174,now you just look like,1
175,you just look like anyone,1
176,just look like anyone i,1
177,look like anyone i just,1
159,"not looking like that"" you",1
158,"me not looking like that""",1
157,save me not looking like,1
156,ever save me not looking,1
139,so worried about you lately,1
140,worried about you lately you,1
141,about you lately you look,1
142,you lately you look shit,1
143,lately you look shit and,1
144,you look shit and smell,1
145,look shit and smell a,1
146,shit and smell a bit,1
147,and smell a bit you're,1
148,smell a bit you're mad,1
149,a bit you're mad thinking,1
150,bit you're mad thinking you,1
151,you're mad thinking you could,1
152,mad thinking you could ever,1
153,thinking you could ever save,1
154,you could ever save me,1
155,could ever save me not,1
92,you were coming across as,1
90,left and you were coming,1
179,anyone i just had a,1
32,now it's my time to,1
24,sake i wasn't told you'd,1
25,i wasn't told you'd be,1
26,wasn't told you'd be this,1
27,told you'd be this cold,1
28,you'd be this cold now,1
29,be this cold now it's,1
30,this cold now it's my,1
31,cold now it's my time,1
33,it's my time to depart,1
22,for goodness sake i wasn't,1
34,my time to depart and,1
35,time to depart and i,1
36,to depart and i just,1
37,depart and i just had,1
38,and i just had a,1
42,a change of heart i'll,1
43,change of heart i'll quote,1
44,"of heart i'll quote ""on",1
23,goodness sake i wasn't told,1
21,part for goodness sake i,1
89,i left and you were,1
10,stoned? was it your breasts,1
2,awake? am i too old,1
3,am i too old to,1
4,i too old to be,1
5,too old to be this,1
6,old to be this stoned?,1
7,to be this stoned? was,1
8,be this stoned? was it,1
9,this stoned? was it your,1
11,was it your breasts from,1
20,a part for goodness sake,1
12,it your breasts from the,1
13,your breasts from the start?,1
14,breasts from the start? they,1
15,from the start? they played,1
16,the start? they played a,1
17,start? they played a part,1
18,they played a part for,1
19,played a part for goodness,1
45,"heart i'll quote ""on the",1
46,"i'll quote ""on the road""",1
47,"quote ""on the road"" like",1
79,you smashed a glass into,1
70,be hard oh i just,1
71,hard oh i just had,1
73,a change of heart [instrumental,1
74,change of heart [instrumental interlude],1
75,of heart [instrumental interlude] you,1
76,heart [instrumental interlude] you smashed,1
77,[instrumental interlude] you smashed a,1
78,interlude] you smashed a glass,1
80,smashed a glass into pieces,1
48,"""on the road"" like a",1
81,a glass into pieces that's,1
82,glass into pieces that's around,1
83,into pieces that's around the,1
84,pieces that's around the time,1
85,that's around the time i,1
86,around the time i left,1
87,the time i left and,1
88,time i left and you,1
69,won't be hard oh i,1
68,pretty won't be hard oh,1
67,equally pretty won't be hard,1
66,is equally pretty won't be,1
49,"the road"" like a twat",1
50,"road"" like a twat and",1
51,like a twat and wind,1
52,a twat and wind my,1
53,twat and wind my way,1
54,and wind my way out,1
55,wind my way out of,1
56,my way out of the,1
57,way out of the city,1
58,out of the city finding,1
59,of the city finding a,1
60,the city finding a girl,1
61,city finding a girl who,1
62,finding a girl who is,1
63,a girl who is equally,1
64,girl who is equally pretty,1
65,who is equally pretty won't,1
178,like anyone i just had,1
181,change of heart i feel,1
415,i mean if it was,1
321,just like i lostmyhead lostmyhead,1
313,tossed and i turn in,1
314,and i turn in my,1
315,i turn in my bed,1
316,turn in my bed it's,1
317,in my bed it's just,1
318,my bed it's just like,1
319,bed it's just like i,1
320,it's just like i lostmyhead,1
322,like i lostmyhead lostmyhead [chorus],1
311,and i tossed and i,1
323,i lostmyhead lostmyhead [chorus] and,1
324,lostmyhead lostmyhead [chorus] and if,1
325,lostmyhead [chorus] and if i,1
367,you jesus show yourself [verse,1
368,jesus show yourself [verse 2],1
369,show yourself [verse 2] i,1
370,yourself [verse 2] i thought,1
371,[verse 2] i thought i’d,1
312,i tossed and i turn,1
310,[pre-chorus] and i tossed and,1
289,[verse 1] i’ve got a,1
299,and i’m petrified of being,1
291,i’ve got a god shaped,1
292,got a god shaped hole,1
293,a god shaped hole that’s,1
294,god shaped hole that’s infected,1
295,shaped hole that’s infected and,1
296,hole that’s infected and i’m,1
297,that’s infected and i’m petrified,1
298,infected and i’m petrified of,1
300,i’m petrified of being alone,1
309,know [pre-chorus] and i tossed,1
301,petrified of being alone now,1
302,of being alone now it's,1
303,being alone now it's pathetic,1
304,alone now it's pathetic i,1
305,now it's pathetic i know,1
306,it's pathetic i know [pre-chorus],1
307,pathetic i know [pre-chorus] and,1
308,i know [pre-chorus] and i,1
372,2] i thought i’d met,1
373,i thought i’d met you,1
374,thought i’d met you once,1
405,had a revelation i'll be,1
397,consciousness is primary in the,1
398,is primary in the universe,1
399,primary in the universe and,1
400,in the universe and i,1
401,the universe and i had,1
402,universe and i had a,1
403,and i had a revelation,1
404,i had a revelation i'll,1
406,a revelation i'll be your,1
375,i’d met you once or,1
407,revelation i'll be your child,1
408,i'll be your child if,1
409,be your child if you,1
410,your child if you insist,1
411,child if you insist i,1
412,if you insist i mean,1
413,you insist i mean if,1
414,insist i mean if it,1
396,me consciousness is primary in,1
395,showing me consciousness is primary,1
394,mind showing me consciousness is,1
393,my mind showing me consciousness,1
376,met you once or twice,1
377,you once or twice but,1
378,once or twice but that,1
379,or twice but that was,1
380,twice but that was just,1
381,but that was just because,1
382,that was just because the,1
383,was just because the dabs,1
384,just because the dabs were,1
385,because the dabs were nice,1
386,the dabs were nice and,1
387,dabs were nice and opening,1
388,were nice and opening up,1
389,nice and opening up my,1
390,and opening up my mind,1
391,opening up my mind showing,1
392,up my mind showing me,1
290,1] i’ve got a god,1
288,much [verse 1] i’ve got,1
182,of heart i feel as,1
213,"""i've been so worried 'bout",1
205,in the car oh i,1
206,the car oh i just,1
207,car oh i just had,1
208,a change of heart then,1
209,change of heart then she,1
210,of heart then she said,1
211,"heart then she said ""i've",1
212,"then she said ""i've been",1
214,been so worried 'bout you,1
203,and cried in the car,1
215,so worried 'bout you lately,1
216,worried 'bout you lately you,1
217,'bout you lately you were,1
218,you lately you were fit,1
219,lately you were fit but,1
220,you were fit but you're,1
221,were fit but you're losing,1
222,fit but you're losing it,1
204,cried in the car oh,1
202,self-pity and cried in the,1
287,isn't much [verse 1] i’ve,1
191,i never found love in,1
183,heart i feel as though,1
184,i feel as though i,1
185,feel as though i was,1
186,as though i was deceived,1
187,though i was deceived i,1
188,i was deceived i never,1
189,was deceived i never found,1
190,deceived i never found love,1
192,never found love in the,1
201,in self-pity and cried in,1
193,found love in the city,1
194,love in the city i,1
195,in the city i just,1
196,the city i just sat,1
197,city i just sat in,1
198,i just sat in self-pity,1
199,just sat in self-pity and,1
200,sat in self-pity and cried,1
223,but you're losing it you,1
224,you're losing it you played,1
225,losing it you played a,1
270,[instrumental] [outro] early early early,1
251,heart [verse] before you go,1
252,[verse] before you go turn,1
253,before you go turn the,1
254,you go turn the big,1
266,the big light off [instrumental],1
267,big light off [instrumental] [outro],1
268,light off [instrumental] [outro] early,1
269,off [instrumental] [outro] early early,1
271,[outro] early early early early,1
226,it you played a part,1
273,early early early early monogamy,1
274,early early early monogamy there,1
281,monogamy there isn't much monogamy,1
282,there isn't much monogamy there,1
283,isn't much monogamy there isn't,1
284,much monogamy there isn't much,1
285,monogamy there isn't much [verse,1
286,there isn't much [verse 1],1
250,of heart [verse] before you,1
249,change of heart [verse] before,1
248,a change of heart [verse],1
247,heart oh i just had,1
227,you played a part 'this,1
228,played a part 'this is,1
229,a part 'this is how,1
230,part 'this is how it,1
231,"'this is how it starts'""",1
232,"is how it starts'"" oh",1
233,"how it starts'"" oh i",1
234,"it starts'"" oh i just",1
235,"starts'"" oh i just had",1
236,a change of heart ​,1
237,change of heart ​ i,1
238,of heart ​ i just,1
239,heart ​ i just had,1
240,​ i just had a,1
244,a change of heart oh,1
245,change of heart oh i,1
246,of heart oh i just,1
804,"and too much racket ""i",1
805,"too much racket ""i think",1
806,"much racket ""i think i've",1
1333,sleep to avoid pain and,1
1286,now [chorus] if she likes,1
1326,american she's american [verse 2],1
1327,she's american [verse 2] she's,1
1328,american [verse 2] she's inducing,1
1329,[verse 2] she's inducing sleep,1
1330,2] she's inducing sleep to,1
1331,she's inducing sleep to avoid,1
1332,inducing sleep to avoid pain,1
1334,to avoid pain and i,1
1284,look pathetic now [chorus] if,1
1335,avoid pain and i think,1
1336,pain and i think she's,1
1337,and i think she's got,1
1338,i think she's got a,1
1339,think she's got a gun,1
1340,she's got a gun divinely,1
1341,got a gun divinely decreed,1
1342,a gun divinely decreed and,1
1285,pathetic now [chorus] if she,1
1283,just look pathetic now [chorus],1
1262,lot to learn [pre-chorus] and,1
1272,with this city but the,1
1264,learn [pre-chorus] and you know,1
1265,[pre-chorus] and you know i'm,1
1266,and you know i'm in,1
1267,you know i'm in love,1
1268,know i'm in love with,1
1269,i'm in love with this,1
1270,in love with this city,1
1271,love with this city but,1
1273,this city but the green,1
1282,i just look pathetic now,1
1274,city but the green is,1
1275,but the green is turning,1
1276,the green is turning brown,1
1277,green is turning brown and,1
1278,is turning brown and i,1
1279,turning brown and i just,1
1280,brown and i just look,1
1281,and i just look pathetic,1
1343,gun divinely decreed and custom,1
1344,divinely decreed and custom made,1
1345,decreed and custom made she,1
1376,[pre-chorus] there's no more water,1
1368,and think you're in love,1
1369,think you're in love with,1
1370,you're in love with the,1
1371,in love with the girl,1
1372,love with the girl [pre-chorus],1
1373,with the girl [pre-chorus] there's,1
1374,the girl [pre-chorus] there's no,1
1375,girl [pre-chorus] there's no more,1
1377,there's no more water in,1
1346,and custom made she calls,1
1378,no more water in this,1
1379,more water in this city,1
1380,water in this city but,1
1381,in this city but be,1
1382,this city but be careful,1
1383,city but be careful or,1
1384,but be careful or you'll,1
1385,be careful or you'll drown,1
1367,moment and think you're in,1
1366,the moment and think you're,1
1365,with the moment and think,1
1364,love with the moment and,1
1347,custom made she calls on,1
1348,made she calls on the,1
1349,she calls on the phone,1
1350,calls on the phone like,1
1351,on the phone like the,1
1352,the phone like the old,1
1353,phone like the old days,1
1354,like the old days expecting,1
1355,the old days expecting the,1
1356,old days expecting the world,1
1357,days expecting the world and,1
