,ngram,count
774,was playing the guitar,1
773,i was playing the,1
743,like it was a,1
741,it felt like it,1
684,from music for cars,1
712,healy: my nana who,1
710,track? matty healy: my,1
709,the track? matty healy:,1
708,behind the track? matty,1
707,idea behind the track?,1
706,the idea behind the,1
705,was the idea behind,1
704,what was the idea,1
703,lyrics what was the,1
702,no lyrics what was,1
701,features no lyrics what,1
700,it features no lyrics,1
699,fact it features no,1
698,the fact it features,1
697,especially the fact it,1
696,before especially the fact,1
695,done before especially the,1
694,you’ve done before especially,1
693,what you’ve done before,1
692,from what you’ve done,1
691,cry from what you’ve,1
690,far cry from what,1
689,a far cry from,1
688,is a far cry,1
687,cars is a far,1
686,for cars is a,1
711,matty healy: my nana,1
713,my nana who i,1
740,and it felt like,1
714,nana who i was,1
739,cancer and it felt,1
738,with cancer and it,1
737,diagnosed with cancer and,1
736,got diagnosed with cancer,1
735,mum got diagnosed with,1
734,guitarist’s mum got diagnosed,1
733,the guitarist’s mum got,1
732,that the guitarist’s mum,1
731,time that the guitarist’s,1
730,that time that the,1
729,about that time that,1
728,around about that time,1
727,was around about that,1
726,it was around about,1
725,and it was around,1
724,year and it was,1
723,this year and it,1
722,cancer this year and,1
721,of cancer this year,1
720,died of cancer this,1
719,to died of cancer,1
718,close to died of,1
717,was close to died,1
716,i was close to,1
715,who i was close,1
2021,time,1
