,ngram,count
7528,[verse 2] hey now we're,1
7527,no [verse 2] hey now,1
7526,it no [verse 2] hey,1
7525,quit it no [verse 2],1
7524,gonna quit it no [verse,1
7523,toe with guns hidden under,1
7522,to toe with guns hidden,1
7521,head to toe with guns,1
7520,black head to toe with,1
7519,in black head to toe,1
7518,dressed in black head to,1
7517,we're dressed in black head,1
7516,said we're dressed in black,1
7515,she said we're dressed in,1
7514,said she said we're dressed,1
7449,i think about what to,1
7448,do i think about what,1
7447,to do i think about,1
7390,cause you know that you,1
7384,[verse 1] call it a,1
7385,1] call it a split,1
7386,call it a split cause,1
7387,it a split cause you,1
7388,a split cause you know,1
7389,split cause you know that,1
7391,you know that you will,1
7446,what to do i think,1
7392,know that you will you,1
7393,that you will you bite,1
7394,you will you bite your,1
7395,will you bite your friends,1
7396,you bite your friends like,1
7397,bite your friends like chocolate,1
7383,scared [verse 1] call it,1
7382,not scared [verse 1] call,1
7381,i'm not scared [verse 1],1
7380,[hook] i'm not scared i'm,1
7379,set [hook] i'm not scared,1
7378,television set [hook] i'm not,1
7377,bed; television set [hook] i'm,1
7376,your bed; television set [hook],1
7375,in your bed; television set,1
7374,it in your bed; television,1
7373,prefer it in your bed;,1
7372,i prefer it in your,1
7371,oh i prefer it in,1
7370,true oh i prefer it,1
7369,is true oh i prefer,1
7368,saying is true oh i,1
7367,they're saying is true oh,1
7398,your friends like chocolate you,1
7399,friends like chocolate you say,1
7400,like chocolate you say we,1
7430,from the boys in the,1
7445,about what to do i,1
7444,think about what to do,1
7443,now think about what to,1
7442,hey now think about what,1
7441,chocolate hey now think about,1
7440,like chocolate hey now think,1
7438,car smells like chocolate hey,1
7437,my car smells like chocolate,1
7436,and my car smells like,1
7435,blue and my car smells,1
7434,the blue and my car,1
7433,in the blue and my,1
7432,boys in the blue and,1
7431,the boys in the blue,1
7429,away from the boys in,1
7401,chocolate you say we go,1
7428,run away from the boys,1
7427,run run away from the,1
7426,we run run away from,1
7425,now we run run away,1
7424,no now we run run,1
7423,it no now we run,1
7422,quit it no now we,1
7421,gonna quit it no now,1
7408,knows got guns hidden under,1
7407,nobody knows got guns hidden,1
7406,where nobody knows got guns,1
7405,go where nobody knows got,1
7403,say we go where nobody,1
7402,you say we go where,1
7878,i jumped on a bus,1
7880,on a bus declared my,1
8537,"then he said ""i lost",1
8334,tabs with unlimited o's new,1
8328,my car i'm sleeping in',1
8329,car i'm sleeping in' [bridge],1
8330,i'm sleeping in' [bridge] tabs,1
8331,sleeping in' [bridge] tabs with,1
8332,in' [bridge] tabs with unlimited,1
8333,[bridge] tabs with unlimited o's,1
8335,with unlimited o's new clothes,1
8343,and walking back home has,1
8336,unlimited o's new clothes bloody,1
8337,o's new clothes bloody nose,1
8338,new clothes bloody nose powders,1
8339,clothes bloody nose powders and,1
8340,bloody nose powders and walking,1
8341,nose powders and walking back,1
8327,'it's my car i'm sleeping,1
8326,barks 'it's my car i'm,1
8325,he barks 'it's my car,1
8324,then he barks 'it's my,1
8323,and then he barks 'it's,1
8322,smoking and then he barks,1
8321,was smoking and then he,1
8320,he was smoking and then,1
8319,blues he was smoking and,1
8318,that blues he was smoking,1
8317,for that blues he was,1
8316,barred for that blues he,1
8315,been barred for that blues,1
8314,just been barred for that,1
8313,he's just been barred for,1
8312,gin he's just been barred,1
8311,of gin he's just been,1
8342,powders and walking back home,1
8344,walking back home has he,1
8309,that tastes of gin he's,1
8369,3] 'i'm searching you mate,1
8363,that we're talking about him,1
8364,we're talking about him [verse,1
8365,talking about him [verse 3],1
8366,about him [verse 3] 'i'm,1
8367,him [verse 3] 'i'm searching,1
8368,[verse 3] 'i'm searching you,1
8370,'i'm searching you mate your,1
8345,back home has he got,1
8371,searching you mate your jaw's,1
8372,you mate your jaw's all,1
8373,mate your jaw's all over,1
8374,your jaw's all over the,1
8375,jaw's all over the place',1
8376,all over the place' can't,1
8362,believe that we're talking about,1
8361,can't believe that we're talking,1
8360,i can't believe that we're,1
8359,alone i can't believe that,1
8358,floor alone i can't believe,1
8357,the floor alone i can't,1
8356,on the floor alone i,1
8355,retching on the floor alone,1
8354,phone retching on the floor,1
8353,broken phone retching on the,1
8352,no broken phone retching on,1
8351,weed? no broken phone retching,1
8350,enough weed? no broken phone,1
8349,got enough weed? no broken,1
8348,he got enough weed? no,1
8347,has he got enough weed?,1
8346,home has he got enough,1
8310,tastes of gin he's just,1
8308,mouth that tastes of gin,1
7881,a bus declared my name,1
8264,his skin he's got his,1
8258,half the boy is rushing,1
8259,the boy is rushing out,1
8260,boy is rushing out his,1
8261,is rushing out his skin,1
8262,rushing out his skin he's,1
8263,out his skin he's got,1
8265,skin he's got his charm,1
8273,that are smoking he takes,1
8266,he's got his charm with,1
8267,got his charm with the,1
8268,his charm with the girls,1
8269,charm with the girls that,1
8270,with the girls that are,1
8271,the girls that are smoking,1
8257,a half the boy is,1
8256,and a half the boy,1
8255,2 and a half the,1
8254,in 2 and a half,1
8253,him in 2 and a,1
8252,let him in 2 and,1
8251,gonna let him in 2,1
8250,not gonna let him in,1
8249,they're not gonna let him,1
8248,cos they're not gonna let,1
8247,off cos they're not gonna,1
8246,going off cos they're not,1
8245,it's going off cos they're,1
8244,1] it's going off cos,1
8243,[verse 1] it's going off,1
8242,spend? [verse 1] it's going,1
8241,to spend? [verse 1] it's,1
8272,girls that are smoking he,1
8274,are smoking he takes her,1
8307,powdered mouth that tastes of,1
8299,up his chin he thinks,1
8293,broken half a glass has,1
8294,half a glass has opened,1
8295,a glass has opened up,1
8296,glass has opened up his,1
8297,has opened up his chin,1
8298,opened up his chin he,1
8300,his chin he thinks he's,1
8275,smoking he takes her arm,1
8301,chin he thinks he's hard,1
8302,he thinks he's hard a,1
8303,thinks he's hard a powdered,1
8304,he's hard a powdered mouth,1
8305,hard a powdered mouth that,1
8306,a powdered mouth that tastes,1
8292,a broken half a glass,1
8291,2] a broken half a,1
8290,[verse 2] a broken half,1
8289,spend? [verse 2] a broken,1
8288,to spend? [verse 2] a,1
8287,money to spend? [verse 2],1
8286,in [chorus] drink slow to,1
8285,he's in [chorus] drink slow,1
8284,now he's in [chorus] drink,1
8283,and now he's in [chorus],1
8282,bar and now he's in,1
8281,the bar and now he's,1
8280,jumps the bar and now,1
8279,arm jumps the bar and,1
8278,her arm jumps the bar,1
8277,takes her arm jumps the,1
8276,he takes her arm jumps,1
8377,over the place' can't talk,1
8378,the place' can't talk quick,1
8379,place' can't talk quick slap,1
8494,watch you? broken heads in,1
8488,who can watch you? is,1
8489,can watch you? is there,1
8490,watch you? is there somebody,1
8491,you? is there somebody who,1
8492,who can watch you? broken,1
8493,can watch you? broken heads,1
8495,you? broken heads in hospital,1
8503,and pulling your friends while,1
8496,broken heads in hospital beds,1
8497,heads in hospital beds saving,1
8498,in hospital beds saving ends,1
8499,hospital beds saving ends and,1
8500,beds saving ends and pulling,1
8501,saving ends and pulling your,1
8487,love you is there somebody,1
8486,you? love you is there,1
8485,love you? love you is,1
8484,can love you? love you,1
8483,who can love you? love,1
8482,somebody who can love you?,1
8481,there somebody who can love,1
8480,you? i know it's me,1
8479,watch you? i know it's,1
8478,can watch you? i know,1
8477,who can watch you? i,1
8455,clothes i know it's me,1
8454,my clothes i know it's,1
8453,wash my clothes i know,1
8452,to wash my clothes i,1
8451,just to wash my clothes,1
8450,by just to wash my,1
8502,ends and pulling your friends,1
8504,pulling your friends while you're,1
8380,can't talk quick slap in,1
8529,take draws to sort your,1
8523,she's rushing in your bed,1
8524,rushing in your bed you,1
8525,in your bed you take,1
8526,your bed you take draws,1
8527,bed you take draws to,1
8528,you take draws to sort,1
8530,draws to sort your head,1
8505,your friends while you're chasing,1
8531,to sort your head and,1
8532,sort your head and facedown,1
8533,your head and facedown then,1
8534,head and facedown then he,1
8535,and facedown then he said,1
8536,"facedown then he said ""i",1
8522,facedown she's rushing in your,1
8521,and facedown she's rushing in,1
8520,blue and facedown she's rushing,1
8519,and blue and facedown she's,1
8518,black and blue and facedown,1
8517,he's black and blue and,1
8516,through he's black and blue,1
8515,it through he's black and,1
8514,made it through he's black,1
8513,we made it through he's,1
8512,line we made it through,1
8511,first line we made it,1
8510,the first line we made,1
8509,chasing the first line we,1
8508,you're chasing the first line,1
8507,while you're chasing the first,1
8506,friends while you're chasing the,1
8449,stopped by just to wash,1
8448,i stopped by just to,1
8447,close i stopped by just,1
8404,because of his race? 'look,1
8398,you singling him out is,1
8399,singling him out is it,1
8400,him out is it because,1
8401,out is it because of,1
8402,is it because of his,1
8403,it because of his race?,1
8405,of his race? 'look the,1
8446,me close i stopped by,1
8406,his race? 'look the dog,1
8407,race? 'look the dog won't,1
8408,'look the dog won't bark,1
8409,the dog won't bark if,1
8410,dog won't bark if you,1
8411,won't bark if you don't,1
8397,why you singling him out,1
8396,case why you singling him,1
8395,a case why you singling,1
8394,friends a case why you,1
8393,your friends a case why,1
8392,but your friends a case,1
8391,nut but your friends a,1
8390,a nut but your friends,1
8389,threw a nut but your,1
8388,i threw a nut but,1
8387,yes i threw a nut,1
8386,face yes i threw a,1
8385,the face yes i threw,1
8384,in the face yes i,1
8383,slap in the face yes,1
8382,quick slap in the face,1
8381,talk quick slap in the,1
8412,bark if you don't lark,1
8413,if you don't lark about',1
8414,you don't lark about' [outro],1
8431,me m-o-n-e-y i preferred it,1
8445,hold me close i stopped,1
8444,house hold me close i,1
8443,our house hold me close,1
8442,lost our house hold me,1
8441,more lost our house hold,1
8440,dad more lost our house,1
8439,ring dad more lost our,1
8438,should ring dad more lost,1
8437,we should ring dad more,1
8436,before we should ring dad,1
8435,it before we should ring,1
8434,preferred it before we should,1
8433,i preferred it before we,1
8432,m-o-n-e-y i preferred it before,1
8430,m-o-n-e-y's me m-o-n-e-y i preferred,1
8415,don't lark about' [outro] m-o-n-e-y's,1
8429,m-o-n-e-y m-o-n-e-y's me m-o-n-e-y i,1
8428, m-o-n-e-y m-o-n-e-y's me m-o-n-e-y,1
8427,m-o-n-e  m-o-n-e-y m-o-n-e-y's me,1
8426, m-o-n-e  m-o-n-e-y m-o-n-e-y's,1
8425,m-o-n-e  m-o-n-e  m-o-n-e-y,1
8424,m-o-n-e-y m-o-n-e  m-o-n-e ,1
8423,me m-o-n-e-y m-o-n-e  m-o-n-e,1
8422,m-o-n-e-y's me m-o-n-e-y m-o-n-e ,1
8421,m-o-n-e-y m-o-n-e-y's me m-o-n-e-y m-o-n-e,1
8420,me m-o-n-e-y m-o-n-e-y's me m-o-n-e-y,1
8419,m-o-n-e-y's me m-o-n-e-y m-o-n-e-y's me,1
8418,[outro] m-o-n-e-y's me m-o-n-e-y m-o-n-e-y's,1
8417,about' [outro] m-o-n-e-y's me m-o-n-e-y,1
8416,lark about' [outro] m-o-n-e-y's me,1
8240,money to spend? [verse 1],1
8203,baby [chorus] drink slow to,1
8202,me baby [chorus] drink slow,1
7974,pain but she couldn't find,1
7968,nurse told me she felt,1
7969,told me she felt my,1
7970,me she felt my pain,1
7971,she felt my pain but,1
7972,felt my pain but she,1
7973,my pain but she couldn't,1
7975,but she couldn't find a,1
7983,"my brain ""oops i did",1
7976,she couldn't find a single,1
7977,couldn't find a single trace,1
7978,find a single trace of,1
7979,a single trace of my,1
7980,single trace of my brain,1
7981,"trace of my brain ""oops",1
7967,nice nurse told me she,1
7966,the nice nurse told me,1
7965,[outro] the nice nurse told,1
7964,[instrumental] [outro] the nice nurse,1
7963,brain? [instrumental] [outro] the nice,1
7962,my brain? [instrumental] [outro] the,1
7961,was my brain? [instrumental] [outro],1
7960,i was my brain? [instrumental],1
7959,if i was my brain?,1
7958,be if i was my,1
7957,i be if i was,1
7956,would i be if i,1
7955,where would i be if,1
7954,insane where would i be,1
7953,me insane where would i,1
7952,drove me insane where would,1
7951,it drove me insane where,1
7982,"of my brain ""oops i",1
7984,"brain ""oops i did it",1
8018,of freedom in your life,1
8009,im bigger than my body,1
8003,adolescent on a phone speaking,1
8004,on a phone speaking like,1
8005,a phone speaking like im,1
8006,phone speaking like im bigger,1
8007,speaking like im bigger than,1
8008,like im bigger than my,1
8010,bigger than my body i,1
7985,"""oops i did it again""",1
8011,than my body i personify,1
8012,my body i personify that,1
8013,body i personify that lack,1
8014,i personify that lack of,1
8015,personify that lack of freedom,1
8016,that lack of freedom in,1
8002,the adolescent on a phone,1
8001,personify the adolescent on a,1
8000,i personify the adolescent on,1
7999,1] i personify the adolescent,1
7998,[verse 1] i personify the,1
7997,name [verse 1] i personify,1
7996,my name [verse 1] i,1
7995,remember my name [verse 1],1
7994,brain remember my name [verse,1
7993,my brain remember my name,1
7992,forget my brain remember my,1
7991,playing forget my brain remember,1
7990,started playing forget my brain,1
7989,"again"" started playing forget my",1
7988,"it again"" started playing forget",1
7987,"did it again"" started playing",1
7986,"i did it again"" started",1
7950,day it drove me insane,1
7949,all day it drove me,1
7948,searched all day it drove,1
7905,sign an autograph for my,1
7899,"for a run ""and would",1
7900,"a run ""and would you",1
7901,"run ""and would you sign",1
7902,"""and would you sign an",1
7903,would you sign an autograph,1
7904,you sign an autograph for,1
7906,an autograph for my daughter,1
7947,i searched all day it,1
7907,autograph for my daughter laura?,1
7908,for my daughter laura? cause,1
7909,my daughter laura? cause she,1
7910,daughter laura? cause she adores,1
7911,laura? cause she adores you,1
7912,cause she adores you but,1
7898,"going for a run ""and",1
7897,seen going for a run,1
7896,last seen going for a,1
7895,was last seen going for,1
7894,brain was last seen going,1
7893,your brain was last seen,1
7892,brain your brain was last,1
7891,my brain your brain was,1
7890,seen my brain your brain,1
7889,anybody's seen my brain your,1
7888,if anybody's seen my brain,1
7887,asked if anybody's seen my,1
7886,and asked if anybody's seen,1
7885,name and asked if anybody's,1
7884,my name and asked if,1
7883,declared my name and asked,1
7882,bus declared my name and,1
7913,she adores you but i,1
7914,adores you but i think,1
7915,you but i think youre,1
7932,outside it hurt my eyes,1
7946,mind! i searched all day,1
7945,no mind! i searched all,1
7944,got no mind! i searched,1
7943,youve got no mind! i,1
7942,when youve got no mind!,1
7941,expect when youve got no,1
7940,you expect when youve got,1
7939,do you expect when youve,1
7938,what do you expect when,1
7937,well what do you expect,1
7936,eyes well what do you,1
7935,my eyes well what do,1
7934,hurt my eyes well what,1
7933,it hurt my eyes well,1
7931,stepped outside it hurt my,1
7916,"but i think youre shit""",1
7930,i stepped outside it hurt,1
7929,bit! i stepped outside it,1
7928,a bit! i stepped outside,1
7927,for a bit! i stepped,1
7926,brain for a bit! i,1
7925,my brain for a bit!,1
7924,for my brain for a,1
7923,look for my brain for,1
7922,gotta look for my brain,1
7921,"""ive gotta look for my",1
7920,"shit"" ""ive gotta look for",1
7919,"youre shit"" ""ive gotta look",1
7918,"think youre shit"" ""ive gotta",1
7917,"i think youre shit"" ""ive",1
8017,lack of freedom in your,1
8019,freedom in your life and,1
8201,around me baby [chorus] drink,1
8157,to rearrange your world? you,1
8151,"you 'bout this girl?"" the",1
8152,"'bout this girl?"" the one",1
8153,"this girl?"" the one to",1
8154,"girl?"" the one to rearrange",1
8155,the one to rearrange your,1
8156,one to rearrange your world?,1
8158,rearrange your world? you got,1
8166,you find out that your,1
8159,your world? you got excited,1
8160,world? you got excited and,1
8161,you got excited and now,1
8162,got excited and now you,1
8163,excited and now you find,1
8164,and now you find out,1
8150,"tell you 'bout this girl?""",1
8149,i tell you 'bout this,1
8148,did i tell you 'bout,1
8147,"""what did i tell you",1
8146,"[pre-chorus] ""what did i tell",1
8145,"you [pre-chorus] ""what did i",1
8144,"of you [pre-chorus] ""what did",1
8143,"instead of you [pre-chorus] ""what",1
8142,something instead of you [pre-chorus],1
8141,feeling something instead of you,1
8140,'bout feeling something instead of,1
8139,dreaming 'bout feeling something instead,1
8138,be dreaming 'bout feeling something,1
8137,must be dreaming 'bout feeling,1
8136,i must be dreaming 'bout,1
8135,guess i must be dreaming,1
8134,i guess i must be,1
8165,now you find out that,1
8167,find out that your 'girl',1
8020,in your life and i'm,1
8192,baby [instrumental break] [chorus variation],1
8186,around me baby this must,1
8187,me baby this must be,1
8188,baby this must be my,1
8189,fly around me baby [instrumental,1
8190,around me baby [instrumental break],1
8191,me baby [instrumental break] [chorus,1
8193,[instrumental break] [chorus variation] this,1
8168,out that your 'girl' won't,1
8194,break] [chorus variation] this must,1
8195,[chorus variation] this must be,1
8196,variation] this must be my,1
8198,around me baby [chorus] this,1
8199,me baby [chorus] this must,1
8200,baby [chorus] this must be,1
8185,fly around me baby this,1
8184,] this must be my,1
8183,[chorus ] this must be,1
8182,chest [chorus ] this must,1
8181,beating chest [chorus ] this,1
8180,your beating chest [chorus ],1
8179,about your beating chest [chorus,1
8178,care about your beating chest,1
8177,or care about your beating,1
8176,undressed or care about your,1
8175,you undressed or care about,1
8174,get you undressed or care,1
8173,even get you undressed or,1
8172,won't even get you undressed,1
8171,'girl' won't even get you,1
8170,your 'girl' won't even get,1
8169,that your 'girl' won't even,1
8133,but i guess i must,1
8132,love but i guess i,1
8131,was love but i guess,1
8044,my world takes a particular,1
8038,this girl i thought she'd,1
8039,girl i thought she'd rearrange,1
8040,i thought she'd rearrange my,1
8041,thought she'd rearrange my world,1
8042,she'd rearrange my world takes,1
8043,rearrange my world takes a,1
8045,world takes a particular type,1
8130,it was love but i,1
8046,takes a particular type of,1
8047,a particular type of girl,1
8048,particular type of girl to,1
8049,type of girl to put,1
8050,of girl to put my,1
8051,girl to put my heart,1
8037,'bout this girl i thought,1
8036,you 'bout this girl i,1
8035,tell you 'bout this girl,1
8034,me tell you 'bout this,1
8033,let me tell you 'bout,1
8032,[pre-chorus] let me tell you,1
8031,second [pre-chorus] let me tell,1
8030,a second [pre-chorus] let me,1
8029,in a second [pre-chorus] let,1
8028,gone in a second [pre-chorus],1
8027,be gone in a second,1
8026,she'll be gone in a,1
8025,sure she'll be gone in,1
8024,i'm sure she'll be gone,1
8023,and i'm sure she'll be,1
8022,life and i'm sure she'll,1
8021,your life and i'm sure,1
8052,to put my heart under,1
8053,put my heart under arrest,1
8054,my heart under arrest so,1
8115,pipe down you're no lover,1
8129,thought it was love but,1
8128,i thought it was love,1
8127,well i thought it was,1
8126,to well i thought it,1
8125,it to well i thought,1
8124,want it to well i,1
8123,you want it to well,1
8122,cos' you want it to,1
8121,failing cos' you want it,1
8120,it's failing cos' you want,1
8119,lover it's failing cos' you,1
8118,no lover it's failing cos',1
8117,you're no lover it's failing,1
8116,down you're no lover it's,1
8114,2] pipe down you're no,1
8055,heart under arrest so why's,1
8113,[verse 2] pipe down you're,1
8112,baby [verse 2] pipe down,1
8111,me baby [verse 2] pipe,1
8110,around me baby [verse 2],1
8109,fly around me baby [verse,1
8064,chest? [chorus] this must be,1
8063,my chest? [chorus] this must,1
8062,on my chest? [chorus] this,1
8061,beating on my chest? [chorus],1
8060,this beating on my chest?,1
8059,why's this beating on my,1
8058,so why's this beating on,1
8057,arrest so why's this beating,1
8056,under arrest so why's this,1
5448,hardly speak and when i,1
4955,a part 'this is how,1
5446,i can hardly speak and,1
1863,by sleeping about your ultimatum's,1
1857,now he's making up for,1
1858,he's making up for it,1
1859,making up for it by,1
1860,up for it by sleeping,1
1861,for it by sleeping about,1
1862,it by sleeping about your,1
1864,sleeping about your ultimatum's a,1
1872,gonna pick that option that,1
1865,about your ultimatum's a ridiculous,1
1866,your ultimatum's a ridiculous joke,1
1867,ultimatum's a ridiculous joke i'm,1
1868,a ridiculous joke i'm gonna,1
1869,ridiculous joke i'm gonna pick,1
1870,joke i'm gonna pick that,1
1856,out now he's making up,1
1855,get out now he's making,1
1854,to get out now he's,1
1853,had to get out now,1
1852,we had to get out,1
1851,so we had to get,1
1850,marriage so we had to,1
1849,talking marriage so we had,1
1848,was talking marriage so we,1
1847,she was talking marriage so,1
1846,about she was talking marriage,1
1845,me about she was talking,1
1844,show me about she was,1
1843,can show me about she,1
1842,you can show me about,1
1841,and you can show me,1
1840,one and you can show,1
1871,i'm gonna pick that option,1
1873,pick that option that allows,1
1838,i'm the one and you,1
1898,in the back of my,1
1892,starts you take your shoes,1
1893,you take your shoes off,1
1894,take your shoes off in,1
1895,your shoes off in the,1
1896,shoes off in the back,1
1897,off in the back of,1
1899,the back of my van,1
1874,that option that allows me,1
1900,back of my van yeah,1
1901,of my van yeah my,1
1902,my van yeah my shirt,1
1903,van yeah my shirt looks,1
1904,yeah my shirt looks so,1
1905,my shirt looks so good,1
1891,it starts you take your,1
1890,how it starts you take,1
1889,is how it starts you,1
1888,this is how it starts,1
1887,and this is how it,1
1886,alright and this is how,1
1885,alright alright and this is,1
1884,it's alright alright and this,1
1883,far it's alright alright and,1
1882,i'm alright yeah it's alright,1
1881,but i'm alright yeah it's,1
1880,smoke but i'm alright yeah,1
1879,to smoke but i'm alright,1
1878,me to smoke but i'm,1
1877,allows me to smoke but,1
1876,that allows me to smoke,1
1875,option that allows me to,1
1839,the one and you can,1
1837,that i'm the one and,1
1768,so here we are it's,1
1793,of an hour and why,1
1787,cry until 11 it's a,1
1788,until 11 it's a quarter,1
1789,11 it's a quarter of,1
1790,it's a quarter of an,1
1791,a quarter of an hour,1
1792,quarter of an hour and,1
1794,an hour and why stay,1
1802,it so much? you think,1
1795,hour and why stay if,1
1796,and why stay if you,1
1797,why stay if you hate,1
1798,stay if you hate it,1
1799,if you hate it so,1
1800,you hate it so much?,1
1786,can cry until 11 it's,1
1785,you can cry until 11,1
1784,bar you can cry until,1
1783,the bar you can cry,1
1782,in the bar you can,1
1781,in in the bar you,1
1780,pushing in in the bar,1
1779,town pushing in in the,1
1778,round town pushing in in,1
1777,knocking round town pushing in,1
1776,we're knocking round town pushing,1
1775,11 we're knocking round town,1
1774,to 11 we're knocking round,1
1773,quarter to 11 we're knocking,1
1772,it's quarter to 11 we're,1
1771,are it's quarter to 11,1
1770,we are it's quarter to,1
1801,hate it so much? you,1
1803,so much? you think you're,1
1836,pretend that i'm the one,1
1828,want to take me up,1
1822,ever went to school don't,1
1823,went to school don't you,1
1824,to school don't you want,1
1825,school don't you want to,1
1826,don't you want to take,1
1827,you want to take me,1
1829,to take me up in,1
1804,much? you think you're well,1
1830,take me up in the,1
1831,me up in the clouds?,1
1832,up in the clouds? pretend,1
1833,in the clouds? pretend that,1
1834,the clouds? pretend that i'm,1
1835,clouds? pretend that i'm the,1
1821,hardly ever went to school,1
1820,you hardly ever went to,1
1819,how you hardly ever went,1
1818,and how you hardly ever,1
1817,yourself and how you hardly,1
1816,killing yourself and how you,1
1815,and killing yourself and how,1
1814,sex and killing yourself and,1
1813,about sex and killing yourself,1
1812,write about sex and killing,1
1811,just write about sex and,1
1810,you just write about sex,1
1809,cool you just write about,1
1808,well cool you just write,1
1807,you're well cool you just,1
1806,think you're well cool you,1
1805,you think you're well cool,1
1906,shirt looks so good when,1
1907,looks so good when it's,1
1908,so good when it's just,1
2007,fill his shoes but you,1
2001,my room and i'm about,1
2002,room and i'm about to,1
2003,and i'm about to fill,1
2004,i'm about to fill his,1
2005,about to fill his shoes,1
2006,to fill his shoes but,1
2008,his shoes but you say,1
2019,take care of you? or,1
2009,shoes but you say no,1
2013,no you say no does,1
2014,you say no does he,1
2015,say no does he take,1
2016,no does he take care,1
2017,does he take care of,1
2000,in my room and i'm,1
1999,bed in my room and,1
1998,the bed in my room,1
1997,on the bed in my,1
1996,we're on the bed in,1
