,ngram,count
1026,could i refuse? yeah you,1
1020,of you and i and,1
1021,you and i and how,1
1022,and i and how could,1
1023,i and how could i,1
1024,and how could i refuse?,1
1025,how could i refuse? yeah,1
1027,i refuse? yeah you rid,1
1035,blues ever since you came,1
1028,refuse? yeah you rid me,1
1029,yeah you rid me of,1
1030,you rid me of the,1
1031,rid me of the blues,1
1032,me of the blues ever,1
1033,of the blues ever since,1
1019,state of you and i,1
1018,the state of you and,1
1017,in the state of you,1
1016,even in the state of,1
1015,bye even in the state,1
1014,say bye even in the,1
1013,to say bye even in,1
1012,hard to say bye even,1
1011,it hard to say bye,1
1010,find it hard to say,1
1009,i find it hard to,1
1008,1] i find it hard,1
1007,[verse 1] i find it,1
1006,love [verse 1] i find,1
1005,in love [verse 1] i,1
1004,more in love [verse 1],1
1003,and what about these feelings,1
1034,the blues ever since you,1
1036,ever since you came into,1
1079,you opiate this hazy head,1
1071,that's all i have to,1
1065,"say ""i i adore you""",1
1066,"""i i adore you"" and",1
1067,"i adore you"" and that's",1
1068,"adore you"" and that's all",1
1069,"you"" and that's all i",1
1070,and that's all i have,1
1072,all i have to say,1
1037,since you came into my,1
1073,"i have to say ""bye-bye""",1
1074,"have to say ""bye-bye"" and",1
1075,"to say ""bye-bye"" and you",1
1076,"say ""bye-bye"" and you opiate",1
1077,"""bye-bye"" and you opiate this",1
1078,and you opiate this hazy,1
1064,"i say ""i i adore",1
1063,"you i say ""i i",1
1062,"marry you i say ""i",1
1061,wanna marry you i say,1
1060,i wanna marry you i,1
1059,i i wanna marry you,1
1058,2] i i wanna marry,1
1057,[verse 2] i i wanna,1
1056,medicine [verse 2] i i,1
1055,you're medicine [verse 2] i,1
1054,yeah you're medicine [verse 2],1
1053,medicine yeah you're medicine [verse,1
1042,life [chorus] because you're my,1
1041,my life [chorus] because you're,1
1040,into my life [chorus] because,1
1039,came into my life [chorus],1
1038,you came into my life,1
1242,'til then we'll knock around,1
1243,then we'll knock around and,1
1244,we'll knock around and see,1
1377,deliberate feeling of your arms,1
1371,your heart my place is,1
1372,heart my place is not,1
1373,my place is not deliberate,1
1374,place is not deliberate feeling,1
1375,is not deliberate feeling of,1
1376,not deliberate feeling of your,1
1378,feeling of your arms i,1
1386,be your friend i want,1
1379,of your arms i don't,1
1380,your arms i don't want,1
1381,arms i don't want to,1
1382,i don't want to be,1
1383,don't want to be your,1
1384,want to be your friend,1
1370,to your heart my place,1
1369,according to your heart my,1
1368,[bridge] according to your heart,1
1367,need [bridge] according to your,1
1366,i need [bridge] according to,1
1365,all i need [bridge] according,1
1364,you're all i need [bridge],1
1363,'cause you're all i need,1
1362,maybe 'cause you're all i,1
1361,me? maybe 'cause you're all,1
1360,with me? maybe 'cause you're,1
1359,down with me? maybe 'cause,1
1358,sitting down with me? maybe,1
1357,fancy sitting down with me?,1
1356,you fancy sitting down with,1
1355,do you fancy sitting down,1
1354,alive do you fancy sitting,1
1385,to be your friend i,1
1387,your friend i want to,1
1245,knock around and see if,1
1412,are dry as ice what,1
1406,all soft now and your,1
1407,soft now and your bones,1
1408,now and your bones are,1
1409,and your bones are dry,1
1410,your bones are dry as,1
1411,bones are dry as ice,1
1413,dry as ice what you,1
1388,friend i want to kiss,1
1414,as ice what you sitting,1
1415,ice what you sitting 'round,1
1420,here for and why you,1
1421,for and why you sad?,1
1422,and why you sad? cause,1
1423,why you sad? cause everybody's,1
1405,is all soft now and,1
1404,in is all soft now,1
1403,you're in is all soft,1
1402,that you're in is all,1
1401,skin that you're in is,1
1400,the skin that you're in,1
1399,1] the skin that you're,1
1398,[verse 1] the skin that,1
1397,mind [verse 1] the skin,1
1396,your mind [verse 1] the,1
1395,change your mind [verse 1],1
1394,neck [hook] don't you see,1
1393,your neck [hook] don't you,1
1392,kiss your neck [hook] don't,1
1391,to kiss your neck [hook],1
1390,want to kiss your neck,1
1389,i want to kiss your,1
1353,so alive do you fancy,1
1352,look so alive do you,1
1351,you look so alive do,1
1308,"it's fine"" i read between",1
1302,"coat again you said ""oh",1
1303,"again you said ""oh no",1
1304,"you said ""oh no it's",1
1305,"said ""oh no it's fine""",1
1306,"""oh no it's fine"" i",1
1307,"no it's fine"" i read",1
1309,"fine"" i read between the",1
1350,eyes you look so alive,1
1310,i read between the lines,1
1311,read between the lines and,1
1312,between the lines and touched,1
1313,the lines and touched your,1
1314,lines and touched your leg,1
1315,and touched your leg again,1
1301,your coat again you said,1
1300,on your coat again you,1
1299,caught on your coat again,1
1298,i'm caught on your coat,1
1297,2] i'm caught on your,1
1296,[verse 2] i'm caught on,1
1295,mind [verse 2] i'm caught,1
1294,your mind [verse 2] i'm,1
1293,change your mind [verse 2],1
1253,need [hook] don't you see,1
1252,i need [hook] don't you,1
1251,all i need [hook] don't,1
1250,you're all i need [hook],1
1249,if you're all i need,1
1248,see if you're all i,1
1247,and see if you're all,1
1246,around and see if you're,1
1316,touched your leg again again,1
1317,your leg again again i'll,1
1318,leg again again i'll take,1
1335,but i want you now,1
1349,your eyes you look so,1
1348,in your eyes you look,1
1347,is in your eyes you,1
1346,smoke is in your eyes,1
1345,the smoke is in your,1
1344,when the smoke is in,1
1343,now when the smoke is,1
1342,you now when the smoke,1
1341,want you now when the,1
1340,i want you now when,1
1339,now i want you now,1
1338,you now i want you,1
1337,want you now i want,1
1336,i want you now i,1
1334,oh but i want you,1
1319,again again i'll take it,1
1333,mine oh but i want,1
1332,be mine oh but i,1
1331,will be mine oh but,1
1330,you will be mine oh,1
1329,soon you will be mine,1
1328,time soon you will be,1
1327,a time soon you will,1
1326,at a time soon you,1
1325,day at a time soon,1
1324,one day at a time,1
1323,it one day at a,1
1322,take it one day at,1
1321,i'll take it one day,1
1320,again i'll take it one,1
1002,[chorus] and what about these,1
1000,love [instrumental] [chorus] and what,1
681,so? [verse 1] hey! would,1
789,famous let's be friends and,1
783,"nothing to say oh! ""you",1
784,"to say oh! ""you look",1
785,"say oh! ""you look famous",1
786,"oh! ""you look famous let's",1
787,"""you look famous let's be",1
788,look famous let's be friends,1
790,let's be friends and portray,1
798,important and do the things,1
791,be friends and portray we,1
792,friends and portray we possess,1
793,and portray we possess something,1
794,portray we possess something important,1
795,we possess something important and,1
796,possess something important and do,1
782,got nothing to say oh!,1
781,but got nothing to say,1
780,face but got nothing to,1
779,beautiful face but got nothing,1
778,a beautiful face but got,1
777,got a beautiful face but,1
776,you got a beautiful face,1
775,passion you got a beautiful,1
774,for passion you got a,1
773,bash for passion you got,1
772,of bash for passion you,1
771,bag of bash for passion,1
770,a bag of bash for,1
769,and a bag of bash,1
768,panache and a bag of,1
767,karcrashian panache and a bag,1
766,fashion karcrashian panache and a,1
797,something important and do the,1
799,and do the things we'd,1
764,up in fashion karcrashian panache,1
825,me yeah oh if that's,1
818,"accept!"" yeah yeah yeah?! no!",1
819,yeah yeah yeah?! no! [chorus],1
820,yeah yeah?! no! [chorus] and,1
821,yeah?! no! [chorus] and love,1
822,no! [chorus] and love me,1
824,love me yeah oh if,1
826,yeah oh if that's what,1
800,"do the things we'd like""",1
827,oh if that's what you,1
828,no and love me love,1
829,and love me love me,1
830,love me love me yeah,1
831,me love me yeah if,1
832,do oh yeah? no [interlude],1
817,"we accept!"" yeah yeah yeah?!",1
816,"what we accept!"" yeah yeah",1
815,"of what we accept!"" yeah",1
814,"standards of what we accept!""",1
813,the standards of what we,1
812,in the standards of what,1
811,decline in the standards of,1
810,a decline in the standards,1
809,represent a decline in the,1
808,to represent a decline in,1
807,come to represent a decline,1
806,just come to represent a,1
805,"""we've just come to represent",1
804,"like"" ""we've just come to",1
803,"we'd like"" ""we've just come",1
802,"things we'd like"" ""we've just",1
801,"the things we'd like"" ""we've",1
765,in fashion karcrashian panache and,1
763,caught up in fashion karcrashian,1
999,in love [instrumental] [chorus] and,1
705,change! oh! yeah next thing,1
699,and there's things we'd like,1
700,there's things we'd like to,1
701,things we'd like to change!,1
702,we'd like to change! oh!,1
703,like to change! oh! yeah,1
704,to change! oh! yeah next,1
706,oh! yeah next thing you'll,1
714,about yourself on a plane,1
707,yeah next thing you'll find,1
708,next thing you'll find you're,1
709,thing you'll find you're reading,1
710,you'll find you're reading about,1
711,find you're reading about yourself,1
712,you're reading about yourself on,1
698,online and there's things we'd,1
697,friends online and there's things,1
696,my friends online and there's,1
695,with my friends online and,1
694,just with my friends online,1
693,i'm just with my friends,1
692,no! i'm just with my,1
691,sometimes? no! i'm just with,1
690,outside sometimes? no! i'm just,1
689,look outside sometimes? no! i'm,1
688,to look outside sometimes? no!,1
687,like to look outside sometimes?,1
686,you like to look outside,1
685,would you like to look,1
684,hey! would you like to,1
683,1] hey! would you like,1
682,[verse 1] hey! would you,1
713,reading about yourself on a,1
715,yourself on a plane fame!,1
762,change caught up in fashion,1
754,'bout yourself on a plane,1
748,no [verse 2] you've been,1
749,[verse 2] you've been reading,1
750,2] you've been reading 'bout,1
751,you've been reading 'bout yourself,1
752,been reading 'bout yourself on,1
753,reading 'bout yourself on a,1
755,yourself on a plane fame,1
716,on a plane fame! what,1
756,on a plane fame for,1
757,a plane fame for a,1
758,plane fame for a change,1
759,fame for a change caught,1
760,for a change caught up,1
761,a change caught up in,1
747,yeah? no [verse 2] you've,1
746,oh yeah? no [verse 2],1
745,do oh yeah? no [verse,1
730,looking! [chorus] and love me,1
729,looking looking! [chorus] and love,1
728,looking looking looking! [chorus] and,1
727,looking looking looking looking! [chorus],1
726,keep looking looking looking looking!,1
725,just keep looking looking looking,1
724,well just keep looking looking,1
723,oh! well just keep looking,1
722,shame! oh! well just keep,1
721,a shame! oh! well just,1
720,what a shame! oh! well,1
719,fame! what a shame! oh!,1
718,plane fame! what a shame!,1
717,a plane fame! what a,1
833,oh yeah? no [interlude] [bridge],1
834,yeah? no [interlude] [bridge] oh,1
835,no [interlude] [bridge] oh so,1
951,could have been a great,1
937,enough what about these feelings,1
945,more in love [verse 2],1
946,in love [verse 2] i,1
947,love [verse 2] i could,1
948,[verse 2] i could have,1
949,2] i could have been,1
952,have been a great line,1
960,a sign or overstay my,1
953,been a great line i,1
954,a great line i could,1
955,great line i could have,1
956,line i could have been,1
957,could have been a sign,1
958,have been a sign or,1
936,had enough what about these,1
935,you'd had enough what about,1
934,said you'd had enough what,1
919,"life"" [chorus] so what about",1
918,"my life"" [chorus] so what",1
917,"of my life"" [chorus] so",1
916,"years of my life"" [chorus]",1
915,"four years of my life""",1
914,you four years of my,1
913,gave you four years of,1
912,"""i gave you four years",1
911,"said ""i gave you four",1
910,"she said ""i gave you",1
909,"right? she said ""i gave",1
908,"did right? she said ""i",1
907,i did right? she said,1
906,that i did right? she,1
959,been a sign or overstay,1
961,sign or overstay my time,1
836,[interlude] [bridge] oh so sack,1
986,all the years of my,1
980,it right because i'd give,1
981,right because i'd give you,1
982,because i'd give you all,1
983,i'd give you all the,1
984,give you all the years,1
985,you all the years of,1
987,the years of my life,1
962,or overstay my time say,1
988,years of my life [chorus],1
989,of my life [chorus] so,1
990,my life [chorus] so what,1
991,life [chorus] so what about,1
997,be more in love [instrumental],1
998,more in love [instrumental] [chorus],1
979,made it right because i'd,1
978,that made it right because,1
977,things that made it right,1
976,the things that made it,1
975,all the things that made,1
974,on all the things that,1
973,rely on all the things,1
972,i'll rely on all the,1
971,maybe i'll rely on all,1
970,mind maybe i'll rely on,1
969,your mind maybe i'll rely,1
968,on your mind maybe i'll,1
967,what's on your mind maybe,1
966,say what's on your mind,1
965,time say what's on your,1
964,my time say what's on,1
963,overstay my time say what's,1
905,things that i did right?,1
904,the things that i did,1
903,on the things that i,1
860,"""oh oh oh oh ohhh""",1
854,them up on their feet,1
855,up on their feet say,1
856,"on their feet say ""oh",1
857,"their feet say ""oh oh",1
858,"feet say ""oh oh oh",1
859,"say ""oh oh oh oh",1
861,"oh oh oh ohhh"" [chorus]",1
902,rely on the things that,1
862,"oh oh ohhh"" [chorus] and",1
863,"oh ohhh"" [chorus] and love",1
864,"ohhh"" [chorus] and love me",1
865,love me yeah oh yeah?,1
866,me yeah oh yeah? no,1
867,yeah oh yeah? no and,1
853,gets them up on their,1
852,that gets them up on,1
851,man that gets them up,1
850,the man that gets them,1
849,be the man that gets,1
848,people! be the man that,1
847,the people! be the man,1
846,to the people! be the,1
845,it to the people! be,1
844,give it to the people!,1
843,calendar give it to the,1
842,your calendar give it to,1
841,off your calendar give it,1
840,sack off your calendar give,1
839,so sack off your calendar,1
838,oh so sack off your,1
837,[bridge] oh so sack off,1
868,you wanna do oh yeah,1
869,wanna do oh yeah [verse,1
870,do oh yeah [verse 1],1
887,can find something to show,1
901,i rely on the things,1
900,would i rely on the,1
899,why would i rely on,1
898,time why would i rely,1
897,the time why would i,1
896,got the time why would,1
895,have got the time why,1
894,you have got the time,1
893,if you have got the,1
892,you if you have got,1
891,show you if you have,1
890,to show you if you,1
889,something to show you if,1
888,find something to show you,1
886,i can find something to,1
871,oh yeah [verse 1] at,1
885,but i can find something,1
884,mind but i can find,1
883,my mind but i can,1
882,in my mind but i,1
881,lonely in my mind but,1
880,i'm lonely in my mind,1
879,times i'm lonely in my,1
878,of times i'm lonely in,1
877,best of times i'm lonely,1
876,the best of times i'm,1
875,at the best of times,1
874,1] at the best of,1
873,[verse 1] at the best,1
872,yeah [verse 1] at the,1
2707,mum's car to the edge,1
2709,to the edge of the,1
5445,entropy i can hardly speak,1
4517,gotta search the street when,1
4511,he falls asleep during conversations,1
4512,falls asleep during conversations he's,1
4513,asleep during conversations he's gotta,1
4514,during conversations he's gotta search,1
4515,conversations he's gotta search the,1
4516,he's gotta search the street,1
4518,search the street when he's,1
4526,worst thing is that i'm,1
4519,the street when he's on,1
4520,street when he's on vacation,1
4521,when he's on vacation the,1
4522,he's on vacation the worst,1
4523,on vacation the worst thing,1
4524,vacation the worst thing is,1
4510,complications he falls asleep during,1
4509,some complications he falls asleep,1
4508,into some complications he falls,1
4507,ran into some complications he,1
4506,danny ran into some complications,1
4505,1] danny ran into some,1
4504,[verse 1] danny ran into,1
4503,lies [verse 1] danny ran,1
4502,lies lies [verse 1] danny,1
4501,lies lies lies [verse 1],1
4500,lies lies lies lies [verse,1
4499,them lies lies lies lies,1
4498,telling them lies lies lies,1
4497,you telling them lies lies,1
4496,is you telling them lies,1
4495,take is you telling them,1
4494,can't take is you telling,1
4525,the worst thing is that,1
4527,thing is that i'm in,1
4492,what they can't take is,1
4579,in a petrol station selling,1
4573,in a simulation but he,1
4574,a simulation but he works,1
4575,simulation but he works in,1
4576,but he works in a,1
4577,he works in a petrol,1
4578,works in a petrol station,1
4580,a petrol station selling petrol,1
4528,is that i'm in the,1
4581,petrol station selling petrol he,1
4582,station selling petrol he says,1
4583,selling petrol he says it,1
4584,petrol he says it all,1
4585,he says it all began,1
4586,says it all began with,1
4572,living in a simulation but,1
4571,we're living in a simulation,1
4570,says we're living in a,1
4569,danny says we're living in,1
4568,and danny says we're living,1
4567,2] and danny says we're,1
4566,[verse 2] and danny says,1
4565,you [verse 2] and danny,1
4564,with you [verse 2] and,1
4563,not with you [verse 2],1
4562,it's not with you [verse,1
4534,situation [chorus] and all i,1
4533,same situation [chorus] and all,1
4532,the same situation [chorus] and,1
4531,in the same situation [chorus],1
4530,i'm in the same situation,1
4529,that i'm in the same,1
4493,they can't take is you,1
4491,true what they can't take,1
4422,draw what if you die,1
4447,fourteen times love yourself like,1
4441,brand new try and do,1
4442,new try and do anything,1
4443,try and do anything fourteen,1
4444,and do anything fourteen times,1
4445,do anything fourteen times love,1
4446,anything fourteen times love yourself,1
4448,times love yourself like someone,1
4456,you love don't take any,1
4449,love yourself like someone you,1
4450,yourself like someone you love,1
4451,like someone you love one,1
4452,someone you love one you,1
4453,you love one you love,1
4454,love one you love don't,1
4440,it brand new try and,1
4439,make it brand new try,1
4438,then make it brand new,1
4437,and then make it brand,1
4436,something and then make it,1
4435,take something and then make,1
4434,petrichor] take something and then,1
4433,ii: petrichor] take something and,1
4432,[part ii: petrichor] take something,1
4431,cameras? [part ii: petrichor] take,1
4430,the cameras? [part ii: petrichor],1
4429,of the cameras? [part ii:,1
4428,all of the cameras? [part,1
4427,with all of the cameras?,1
4426,die with all of the,1
4425,you die with all of,1
4424,if you die with all,1
4455,one you love don't take,1
4457,love don't take any of,1
4490,it's true what they can't,1
4482,time they can take anything,1
4476,don't let the internet ruin,1
4477,let the internet ruin your,1
4478,the internet ruin your time,1
4479,internet ruin your time they,1
4480,ruin your time they can,1
4481,your time they can take,1
4483,they can take anything as,1
4458,don't take any of my,1
4484,can take anything as long,1
4485,take anything as long as,1
4486,anything as long as it's,1
4487,as long as it's true,1
4488,long as it's true what,1
4489,as it's true what they,1
4475,change don't let the internet,1
4474,won't change don't let the,1
4473,who won't change don't let,1
4472,self who won't change don't,1
4471,future self who won't change,1
4470,your future self who won't,1
4469,to your future self who,1
4468,letter to your future self,1
4467,a letter to your future,1
4466,write a letter to your,1
4465,advice write a letter to,1
4464,my advice write a letter,1
4463,advice my advice write a,1
4462,my advice my advice write,1
4461,of my advice my advice,1
4460,any of my advice my,1
4459,take any of my advice,1
4587,it all began with his,1
4588,all began with his operation,1
4589,began with his operation and,1
4707,i that i'll lose but,1
4701,i feel sick and i,1
4702,feel sick and i know,1
4703,sick and i know i,1
4704,and i know i that,1
4705,i know i that i'll,1
4706,know i that i'll lose,1
4708,that i'll lose but it's,1
4724,with you are we awake?,1
4709,i'll lose but it's not,1
4710,lose but it's not living,1
4711,but it's not living if,1
4720,with you it's not living,1
4721,you it's not living if,1
4722,it's not with you are,1
4700,me i feel sick and,1
4699,for me i feel sick,1
4698,drinks for me i feel,1
4697,the drinks for me i,1
4696,in the drinks for me,1
4695,pack in the drinks for,1
4694,to pack in the drinks,1
4693,trying to pack in the,1
4692,time trying to pack in,1
4691,the time trying to pack,1
4690,spent the time trying to,1
4689,danny spent the time trying,1
4688,think danny spent the time,1
4687,i think danny spent the,1
4686,bank i think danny spent,1
4685,a bank i think danny,1
4684,in a bank i think,1
4723,not with you are we,1
4725,you are we awake? am,1
4590,with his operation and i,1
4750,sake i wasn't told you'd,1
4744,they played a part for,1
4745,played a part for goodness,1
4746,a part for goodness sake,1
4747,part for goodness sake i,1
4748,for goodness sake i wasn't,1
4749,goodness sake i wasn't told,1
4751,i wasn't told you'd be,1
4726,are we awake? am i,1
4752,wasn't told you'd be this,1
4753,told you'd be this cold,1
4754,you'd be this cold now,1
4755,be this cold now it's,1
4756,this cold now it's my,1
4757,cold now it's my time,1
4743,start? they played a part,1
4742,the start? they played a,1
4741,from the start? they played,1
4740,breasts from the start? they,1
4739,your breasts from the start?,1
4738,it your breasts from the,1
4737,was it your breasts from,1
4736,stoned? was it your breasts,1
4735,this stoned? was it your,1
4734,be this stoned? was it,1
4733,to be this stoned? was,1
4732,old to be this stoned?,1
4731,too old to be this,1
4730,i too old to be,1
4729,am i too old to,1
4728,awake? am i too old,1
4727,we awake? am i too,1
4683,job in a bank i,1
4682,a job in a bank,1
4681,get a job in a,1
4638,or control my feet got,1
4632,you [bridge] i can't stop,1
4633,[bridge] i can't stop sweating,1
4634,i can't stop sweating or,1
4635,can't stop sweating or control,1
4636,stop sweating or control my,1
4637,sweating or control my feet,1
4639,control my feet got a,1
4680,to get a job in,1
4640,my feet got a 20-stone,1
4641,feet got a 20-stone monkey,1
4642,got a 20-stone monkey that,1
4643,a 20-stone monkey that i,1
4644,20-stone monkey that i just,1
4645,monkey that i just can't,1
4631,with you [bridge] i can't,1
4630,not with you [bridge] i,1
4629,it's not with you [bridge],1
4604,imagination [chorus] and all i,1
4603,some imagination [chorus] and all,1
4602,need some imagination [chorus] and,1
4601,you need some imagination [chorus],1
4600,but you need some imagination,1
4599,sly but you need some,1
4598,you're sly but you need,1
4597,think you're sly but you,1
4596,you think you're sly but,1
4595,know you think you're sly,1
4594,i know you think you're,1
4593,and i know you think,1
4592,operation and i know you,1
4591,his operation and i know,1
4646,that i just can't beat,1
4647,i just can't beat i,1
4648,just can't beat i can,1
4665,you're replacing embrace [chorus] it's,1
4679,try to get a job,1
4678,i'll try to get a,1
4677,oh i'll try to get,1
4676,[outro] oh i'll try to,1
4675,you [outro] oh i'll try,1
4674,with you [outro] oh i'll,1
4673,not with you [outro] oh,1
4672,it's not with you [outro],1
4671,that all i do is,1
4670,true that all i do,1
4669,it's true that all i,1
4668,[chorus] it's true that all,1
4667,embrace [chorus] it's true that,1
4666,replacing embrace [chorus] it's true,1
4664,feeling you're replacing embrace [chorus],1
4649,can't beat i can stage,1
4663,a feeling you're replacing embrace,1
4662,there's a feeling you're replacing,1
4661,and there's a feeling you're,1
4660,eat and there's a feeling,1
4659,can't eat and there's a,1
4658,just can't eat and there's,1
4657,i just can't eat and,1
4656,but i just can't eat,1
4655,situation but i just can't,1
4654,a situation but i just,1
4653,stage a situation but i,1
4652,can stage a situation but,1
4651,i can stage a situation,1
4650,beat i can stage a,1
4423,what if you die with,1
4421,to draw what if you,1
4759,it's my time to depart,1
4151,your bed and cried for,1
4145,sun i sat with you,1
4146,i sat with you beside,1
4147,sat with you beside your,1
4148,with you beside your bed,1
4149,you beside your bed and,1
4150,beside your bed and cried,1
4152,bed and cried for things,1
4160,i'd said you still had,1
4153,and cried for things that,1
4154,cried for things that i,1
4155,for things that i wish,1
4156,things that i wish i'd,1
4157,that i wish i'd said,1
4158,i wish i'd said you,1
4144,the sun i sat with,1
4143,you're the sun i sat,1
4142,when you're the sun i,1
4141,warm when you're the sun,1
4140,keep warm when you're the,1
4139,to keep warm when you're,1
4138,trying to keep warm when,1
4137,always trying to keep warm,1
4136,denise always trying to keep,1
4135,from denise always trying to,1
4134,or from denise always trying,1
4133,dad or from denise always,1
4132,my dad or from denise,1
4131,from my dad or from,1
4130,fleece from my dad or,1
4129,borrowed fleece from my dad,1
4128,a borrowed fleece from my,1
4159,wish i'd said you still,1
4161,said you still had your,1
4126,reached for a borrowed fleece,1
4186,and thought that i'd write,1
4180,as you i got my,1
4181,you i got my pen,1
4182,i got my pen and,1
4183,got my pen and thought,1
4184,my pen and thought that,1
4185,pen and thought that i'd,1
4187,thought that i'd write a,1
4162,you still had your nails,1
4188,that i'd write a melody,1
4189,i'd write a melody and,1
4190,write a melody and line,1
4191,a melody and line for,1
4192,melody and line for you,1
4193,and line for you tonight,1
4179,cool as you i got,1
4178,as cool as you i,1
4177,half as cool as you,1
4176,i'm half as cool as,1
