StartDate,EndDate,Status,IPAddress,Progress,Duration (in seconds),Finished,RecordedDate,ResponseId,RecipientLastName,RecipientFirstName,RecipientEmail,ExternalReference,LocationLatitude,LocationLongitude,DistributionChannel,UserLanguage,Q2,Q3
Start Date,End Date,Response Type,IP Address,Progress,Duration (in seconds),Finished,Recorded Date,Response ID,Recipient Last Name,Recipient First Name,Recipient Email,External Data Reference,Location Latitude,Location Longitude,Distribution Channel,User Language,"Describe the color red. What does red look like, feel like, taste like, sound like?",How do you feel right now? Describe using one adjective.
"{""ImportId"":""startDate"",""timeZone"":""America/New_York""}","{""ImportId"":""endDate"",""timeZone"":""America/New_York""}","{""ImportId"":""status""}","{""ImportId"":""ipAddress""}","{""ImportId"":""progress""}","{""ImportId"":""duration""}","{""ImportId"":""finished""}","{""ImportId"":""recordedDate"",""timeZone"":""America/New_York""}","{""ImportId"":""_recordId""}","{""ImportId"":""recipientLastName""}","{""ImportId"":""recipientFirstName""}","{""ImportId"":""recipientEmail""}","{""ImportId"":""externalDataReference""}","{""ImportId"":""locationLatitude""}","{""ImportId"":""locationLongitude""}","{""ImportId"":""distributionChannel""}","{""ImportId"":""userLanguage""}","{""ImportId"":""QID2_TEXT""}","{""ImportId"":""QID3_TEXT""}"
2018-04-23 15:11:10,2018-04-23 15:11:13,Survey Preview Spam,,100,3,True,2018-04-23 15:11:14,R_27EzWywZAeZU5hV,,,,,40.731704711914,-73.988502502441,preview,EN,,
2018-04-23 15:22:16,2018-04-23 15:22:19,IP Address,96.239.100.201,100,3,True,2018-04-23 15:22:19,R_vdCqmVgUPregDBf,,,,,40.731704711914,-73.988502502441,anonymous,EN,,
2018-04-23 15:24:05,2018-04-23 15:24:17,IP Address,157.50.60.223,100,12,True,2018-04-23 15:24:17,R_6LhYOXPh2zxTrJn,,,,,13.083297729492,80.283294677734,anonymous,EN,hjfdshkkakjf,arfetaz
2018-04-23 15:24:02,2018-04-23 15:24:29,IP Address,59.99.220.192,100,27,True,2018-04-23 15:24:30,R_0jIqyuTZVq6XPTX,,,,,8.30810546875,77.221405029297,anonymous,EN,LOOK LIKE,FLOWER
2018-04-23 15:24:24,2018-04-23 15:25:20,IP Address,223.182.192.116,100,55,True,2018-04-23 15:25:21,R_2YyLjdarA16be1z,,,,,10.992492675781,76.961395263672,anonymous,EN,"Red is hot, feel like violence",good
2018-04-23 15:25:24,2018-04-23 15:25:31,IP Address,171.49.185.148,100,7,True,2018-04-23 15:25:32,R_2QPNrncQ1i74eSY,,,,,10.804992675781,78.685607910156,anonymous,EN,cgdj,fgj
2018-04-23 15:25:38,2018-04-23 15:25:50,IP Address,171.49.185.148,100,12,True,2018-04-23 15:25:51,R_2akRn7oilpWjiPe,,,,,10.804992675781,78.685607910156,anonymous,EN,i like,feel right
2018-04-23 15:24:52,2018-04-23 15:26:08,IP Address,108.167.34.44,100,75,True,2018-04-23 15:26:08,R_20Ya3uCHXKGZWRZ,,,,,40.825393676758,-96.674896240234,anonymous,EN,"Red can be an angry color.   It also has warm properties, though, and a certain color of red blanket is nice and comforting.  I don't think of red as having a taste to it.",calm
2018-04-23 15:25:43,2018-04-23 15:26:26,IP Address,158.123.91.23,100,42,True,2018-04-23 15:26:26,R_1ja2s7vPGHR3kE8,,,,,41.478607177734,-71.658599853516,anonymous,EN,"Red is hot, velvety, hushed, quiet, warm, tingling. ",Tired
2018-04-23 15:26:10,2018-04-23 15:27:00,IP Address,65.246.1.5,100,50,True,2018-04-23 15:27:00,R_3pm6aZbXVnPovqr,,,,,39.328796386719,-76.596702575684,anonymous,EN,Red is deep and rich.  Red looks like fire and feels like anger.  It tastes spicy and sounds loud!,Content
2018-04-23 15:27:31,2018-04-23 15:27:54,IP Address,172.90.179.147,100,23,True,2018-04-23 15:27:54,R_yR2eTdbYmKOF37b,,,,,33.941497802734,-118.13069915771,anonymous,EN,"rich, bright, hot, spicy, loud",fine
2018-04-23 15:27:18,2018-04-23 15:27:55,IP Address,199.187.204.235,100,37,True,2018-04-23 15:27:55,R_22Y6E4vQ3xQfJk5,,,,,36.118103027344,-85.659202575684,anonymous,EN,"Red looks like emotion and feels hot, tastes hot and is loud.",bored
2018-04-23 15:27:49,2018-04-23 15:28:06,IP Address,68.200.62.63,100,17,True,2018-04-23 15:28:06,R_3NyowMr6p1xR55D,,,,,28.043792724609,-82.006896972656,anonymous,EN,"it looks evil, have never been a huge fan of red",alright
2018-04-23 15:27:48,2018-04-23 15:28:20,IP Address,163.191.13.70,100,31,True,2018-04-23 15:28:20,R_1S1w1qgShP0XRzb,,,,,39.772003173828,-89.685897827148,anonymous,EN,Red is bold and tastes like cinnamon.  It feels strong and sounds like a loud siren.,Content
2018-04-23 15:26:43,2018-04-23 15:28:55,IP Address,168.235.1.4,100,131,True,2018-04-23 15:28:55,R_1Dpb1NJR3PNWQEM,,,,,41.88020324707,-87.75659942627,anonymous,EN,"Red is a bright beautiful color that can be associated with powerful emotions.  These emotions include anger, hate and energy.  Red is also associated with actions like stopping or halting whatever you are doing.  Red is used as a warning, like when dangerous conditions appear.  It is a strong color that is striking to the eye and very bold. ",powerful
2018-04-23 15:28:00,2018-04-23 15:29:10,IP Address,108.223.156.239,100,69,True,2018-04-23 15:29:10,R_1N8lVcW0Q1FZggU,,,,,35.21989440918,-89.499603271484,anonymous,EN,IT IS A BRIGHT LOOK.  THERE IS NO FEELING.  THERE IS NO TASTE.  THERE IS NO SOUND.,CALM
2018-04-23 15:29:08,2018-04-23 15:29:44,IP Address,50.82.73.90,100,36,True,2018-04-23 15:29:44,R_3JCczNQYDNtB6Wp,,,,,37.218994140625,-93.317596435547,anonymous,EN,Vibrant and bold! It is spicy and quick and sounds very strong.,"good "
2018-04-23 15:29:27,2018-04-23 15:30:39,IP Address,185.217.117.120,100,72,True,2018-04-23 15:30:39,R_1pYvxYmoZtyVqE2,,,,,51.550003051758,-0.050003051757812,anonymous,EN,"Red looks warm, feels hot. Tastes like strawberries and sounds loud",happy
2018-04-23 15:25:46,2018-04-23 15:30:41,IP Address,67.232.32.154,100,294,True,2018-04-23 15:30:41,R_1owrgk8cG5T0u3Z,,,,,28.731292724609,-81.515800476074,anonymous,EN,"Red looks like fire, feels like passionate heat, tastes like spicy cinnamon, and sounds alive like a siren.",Cool
2018-04-23 15:29:59,2018-04-23 15:31:05,IP Address,167.98.10.26,100,65,True,2018-04-23 15:31:05,R_3ML5FH88lhA7fPX,,,,,51.514205932617,-0.093093872070312,anonymous,EN,"The color red feels warm, it tastes spicy, and sounds loud.  It has a lot of character and is fiery and passionate.",Great
2018-04-23 15:33:10,2018-04-23 15:34:10,IP Address,99.105.80.78,100,59,True,2018-04-23 15:34:10,R_3fkE4mIyfPuPjDD,,,,,41.386199951172,-81.791496276855,anonymous,EN,It sounds loud.  It tastes spicy. It feels smooth.  It looks like velvet.,Good
2018-04-23 15:46:35,2018-04-23 15:47:38,IP Address,216.49.246.101,100,63,True,2018-04-23 15:47:39,R_1gHi5RZlalQqbpw,,,,,37.282196044922,-94.481796264648,anonymous,EN,Red is an angry color. It feels like heat. It tastes hot/spicy. It sounds like yelling/screaming.,Content
2018-04-23 15:44:56,2018-04-23 15:48:45,IP Address,117.195.175.206,100,228,True,2018-04-23 15:48:45,R_2EgFXrQtprxuMz5,,,,,17.375305175781,78.474395751953,anonymous,EN,"red looks like blood, it reminds me of chemistry permanganate solution.It causes a feeling of disturbance, something unusual.tastes like pepper .sounds like a big blast.",uneasy
2018-04-23 17:16:08,2018-04-23 17:19:19,IP Address,81.247.86.138,100,191,True,2018-04-23 17:19:20,R_1JWIThB9fRddqMz,,,,,50.846603393555,4.3527984619141,anonymous,EN,"it looks like a flower, or a field of flowers.  It tastes like blood, sour.  And it sounds like the violin in Spring",excited
2018-04-23 20:32:41,2018-04-23 20:33:30,IP Address,59.99.220.192,100,48,True,2018-04-23 20:33:30,R_78poZoWzClO4Zxf,,,,,8.30810546875,77.221405029297,anonymous,EN,RED IS THE MOST ADORABLE COLOR. RED ROSE IS AWESOME COLOR. I LIKE RED.,HAPPY
2018-04-23 15:37:17,2018-04-23 15:42:43,IP Address,157.50.208.2,50,325,False,2018-04-26 15:43:08,R_SZfLDoRkDAtiJK9,,,,,,,anonymous,EN,"Red color is my like  color. red look like to post box and feel like to Brave and hard working,taste like to chily and sound like police cheep silencer sound, co like to happy. ",
2018-04-30 17:26:35,2018-04-30 17:27:04,IP Address,104.191.35.157,100,29,True,2018-04-30 17:27:05,R_1LOuCVJl3njQpKq,,,,,34.169296264648,-118.26629638672,anonymous,EN,"Red is a bright color, red feels warm and red tastes very vibrant and sounds loud. ",tired
2018-04-30 17:28:37,2018-04-30 17:28:56,IP Address,103.55.215.38,100,19,True,2018-04-30 17:28:56,R_3hrNHr8cjIf94HU,,,,,10.350006103516,77.950012207031,anonymous,EN,,HAPPY
2018-04-30 17:27:05,2018-04-30 17:29:11,IP Address,71.68.35.2,100,126,True,2018-04-30 17:29:11,R_3KUgAq9wdu32vpS,,,,,35.183303833008,-80.642303466797,anonymous,EN,Red looks like a heart. It feels warm and hot. It has a spicy taste. It sounds like a burning camp fire.,warm
2018-04-30 17:27:40,2018-04-30 17:29:58,IP Address,76.252.172.234,100,138,True,2018-04-30 17:29:58,R_3fuTpTwMUZNRDZK,,,,,35.871307373047,-78.539398193359,anonymous,EN,"It looks like a dark pink, it feels sexy, it tastes great, and it sounds mesmerizing.",Happy
2018-04-30 17:30:39,2018-04-30 17:31:06,IP Address,144.202.134.130,100,27,True,2018-04-30 17:31:07,R_1M0bV6GvxpsusGH,,,,,39.295196533203,-76.623100280762,anonymous,EN,Red is vibrant and sassy.  Red tastes spicy.,tired
2018-04-30 17:31:20,2018-04-30 17:32:02,IP Address,172.73.204.179,100,41,True,2018-04-30 17:32:02,R_31WLHFke2mrjfRb,,,,,35.323501586914,-81.021499633789,anonymous,EN,"It is hot, taste spicy, and is fast beat fiesta music.",Content
2018-04-30 17:31:59,2018-04-30 17:32:24,IP Address,68.107.106.186,100,24,True,2018-04-30 17:32:24,R_3HhMdXVuSG1FhbU,,,,,32.74479675293,-117.1701965332,anonymous,EN,"Red looks like blood, feels like fire, tastes like hot peppers and sounds like a crackling fire.",depressed
2018-04-30 17:31:20,2018-04-30 17:32:29,IP Address,73.163.22.30,100,68,True,2018-04-30 17:32:29,R_2rjyWXbPzTunLqX,,,,,39.295196533203,-76.623100280762,anonymous,EN,"Fierce, strong, tasty. The sound of red drives fear into people. It establishes dominance and shows strong character. It is a heavy, opinionated color.","Strong, intimidating."
2018-04-30 17:34:32,2018-04-30 17:35:23,IP Address,99.105.80.78,100,50,True,2018-04-30 17:35:23,R_2Y343myIhblftzd,,,,,41.392807006836,-81.734703063965,anonymous,EN,Red feels hot. It would taste warm.  It would look dark.  It would sound loud.,Good
2018-04-30 17:34:50,2018-04-30 17:35:59,IP Address,71.223.237.130,100,68,True,2018-04-30 17:35:59,R_2yr46NF1QOydm28,,,,,33.465194702148,-112.04969787598,anonymous,EN,"Red is very loud. It looks a little rough and tastes kind of coppery. The feeling of it is jagged and sharp. ",Heated
2018-04-30 17:36:03,2018-04-30 17:36:39,IP Address,70.44.106.168,100,35,True,2018-04-30 17:36:39,R_1QH5hk1jyt2Fc20,,,,,40.15739440918,-76.797798156738,anonymous,EN,red looks like blood feels warm tastes sweet and sounds like pain,good
2018-04-30 17:35:01,2018-04-30 17:36:50,IP Address,97.73.80.163,100,108,True,2018-04-30 17:36:50,R_3PfyNQDH3pKmaEV,,,,,38.323196411133,-78.227401733398,anonymous,EN,"Red is a jolt, it's bolt, alarming, it's a warming, it's excited, it tastes irony or like metallic, it sounds piecing, it looks like a flashing light on a police car, it feels sharp.",anxious
2018-04-30 17:37:01,2018-04-30 17:38:02,IP Address,96.59.248.8,100,60,True,2018-04-30 17:38:02,R_1pu54k3kNQpguZ8,,,,,27.866104125977,-82.326499938965,anonymous,EN,Red looks intense and sounds loud. Red makes you feel calm and relaxed.,Happy
2018-04-30 17:40:25,2018-04-30 17:40:56,IP Address,24.34.220.203,100,31,True,2018-04-30 17:40:57,R_2CUJfT04cOt5RA9,,,,,41.549697875977,-72.653099060059,anonymous,EN,Red is solid and tastes like an apple,Good
2018-04-30 17:41:09,2018-04-30 17:42:14,IP Address,67.77.144.69,100,64,True,2018-04-30 17:42:14,R_1duzlsi0x2FbkJA,,,,,36.175003051758,-115.13719940186,anonymous,EN,reminds me of anger.  feels hot. tastes spicy sounds like fire truck,happy
2018-04-30 17:40:38,2018-04-30 17:42:24,IP Address,77.69.253.225,100,105,True,2018-04-30 17:42:24,R_1i5se6D50mUp76T,,,,,26.236099243164,50.583099365234,anonymous,EN,"the colour red is red in colour which may be similar to the colour of blood.it feels like warm colour ,sound like daring.",cool
2018-04-30 17:44:00,2018-04-30 17:44:57,IP Address,2.99.28.102,100,56,True,2018-04-30 17:44:58,R_3Kp6Fc4ahFazk3W,,,,,51.747100830078,-0.019195556640625,anonymous,EN,Red is warm and hot and loud and angry.,alive
2018-04-30 17:47:40,2018-04-30 17:49:30,IP Address,174.255.192.246,100,110,True,2018-04-30 17:49:30,R_3n1P2SkbV1DAXgM,,,,,36.165893554688,-86.784400939941,anonymous,EN,"Red looks angry.  Red feels hot. Red tastes spicy. Red sounds loud. ",Happy
2018-04-30 17:50:08,2018-04-30 17:50:54,IP Address,108.17.11.17,100,45,True,2018-04-30 17:50:54,R_23WSrl75WbYznzp,,,,,42.714096069336,-78.929901123047,anonymous,EN,"RED IS ARM, DEATH RELATED, SWEET WITH A TWIST OF IRON, RED IS DULL SOUNDING, ",CALM
2018-04-30 19:33:24,2018-04-30 19:34:08,IP Address,66.250.143.159,100,43,True,2018-04-30 19:34:08,R_247PMgYivV2sbTr,,,,,39.959701538086,-75.196800231934,anonymous,EN,"Bright and hurts my eyes if I stare out it too much. It sounds loud, and tasty like blood.",average
2018-04-30 22:31:39,2018-04-30 22:33:08,IP Address,73.183.236.88,100,89,True,2018-04-30 22:33:09,R_1QEBBdlC2iMdY7E,,,,,29.69970703125,-95.585800170898,anonymous,EN,"Red is the color of a fire truck. It looks uneasy. It is seen as sexy, but I see it as shallow. However, I do like fire trucks. It feels smooth like a new car's metal. It tastes bad like blood. It sounds cocky. ","elevated "
2018-04-30 17:26:04,2018-04-30 17:26:16,IP Address,74.98.181.177,50,11,False,2018-05-03 17:26:30,R_3gRtMSNYhyfj9Qq,,,,,,,anonymous,EN,McDonald's,
